word	pos	ss:n	definition
sight	n	10:2	anything that is seen
sight	n	10:3	the ability to see; the visual faculty
sight	n	10:4	a range of mental vision
sight	n	10:5	the range of vision
sight	n	10:6	the act of looking or seeing or observing
sight	n	10:7	(often followed by ‘of’) a large number or amount or extent
sight	n	10:8	a place of interest, especially to visitors
sight	v	10:9	catch sight of; to perceive with the eyes
sight	v	10:10	take aim by looking through the sights of a gun (or other device)
sigma	n	1:1	the 18th letter of the Greek alphabet
silex	n	2:1	a vacuum coffee maker
silex	n	2:2	a pure form of finely ground silica
silks	n	1:1	the brightly colored garments of a jockey; emblematic of the stable
silky	s	1:1	having a smooth, gleaming surface reflecting light; being of a smooth, soft and lustrous quality, resembling silk
silly	s	5:1	ludicrous, foolish
silly	s	5:2	lacking seriousness; given to frivolity
silly	s	5:3	inspiring scornful pity
silly	s	5:4	dazed from or as if from repeated blows
silly	n	5:5	a word used for misbehaving children
silty	s	1:1	full of silt
silva	n	1:1	the forest trees growing in a country or region
simal	n	1:1	East Indian silk cotton tree yielding fibers inferior to kapok
sinew	n	2:1	a cord or band of inelastic tissue connecting a muscle with its bony attachment
sinew	n	2:2	possessing muscular strength
singe	n	3:1	a surface burn
singe	v	3:2	burn superficially or lightly
singe	v	3:3	become superficially burned
sinus	n	3:1	an abnormal passage leading from a suppurating cavity to the body surface
sinus	n	3:2	any of various air-filled cavities especially in the bones of the skull
sinus	n	3:3	a wide channel containing blood; does not have the coating of an ordinary blood vessel
siren	n	5:1	a sea nymph (part woman and part bird) supposed to lure sailors to destruction on the rocks where the nymphs lived
siren	n	5:2	a woman who is considered to be dangerously seductive
siren	n	5:3	a warning signal that is a loud wailing sound
siren	n	5:4	an acoustic device producing a loud often wailing sound as a signal or warning
siren	n	5:5	eellike aquatic North American salamander with small forelimbs and no hind limbs; have permanent external gills
siris	n	1:1	large spreading Old World tree having large leaves and globose clusters of greenish-yellow flowers and long seed pods that clatter in the wind
sirup	n	1:1	a thick sweet sticky liquid
sisal	n	2:1	a plant fiber used for making rope
sisal	n	2:2	Mexican or West Indian plant with large fleshy leaves yielding a stiff fiber used in e.g. rope
sissu	n	1:1	East Indian tree whose leaves are used for fodder; yields a compact dark brown durable timber used in shipbuilding and making railroad ties
sissy	s	2:1	having unsuitable feminine qualities
sissy	n	2:2	a timid man or boy considered childish or unassertive
sitar	n	1:1	a stringed instrument of India; has a long neck and movable frets; has 6 or 7 metal strings for playing and usually 13 resonating strings
sixer	n	1:1	the cardinal number that is the sum of five and one
sixth	s	4:1	coming next after the fifth and just before the seventh in position
sixth	n	4:2	position six in a countable series of things
sixth	n	4:3	one part in six equal parts
sixth	n	4:4	the musical interval between one note and another six notes away from it
sixty	s	2:1	being ten more than fifty
sixty	n	2:2	the cardinal number that is the product of ten and six
sized	a	2:1	having a specified size
sized	a	2:2	having the surface treated or coated with sizing
skank	n	3:1	any substance considered disgustingly foul or unpleasant
skank	n	3:2	a rhythmic dance to reggae music performed by bending forward and extending the hands while bending the knees
skank	v	3:3	dance the skank
skate	n	3:1	sports equipment that is worn on the feet to enable the wearer to glide along and to be propelled by the alternate actions of the legs
skate	n	3:2	large edible rays having a long snout and thick tail with pectoral fins continuous with the head; swim by undulating the edges of the pectoral fins
skate	v	3:3	move along on skates
skeet	n	1:1	the sport of shooting at clay pigeons that are hurled upward in such a way as to simulate the flight of a bird
skein	n	1:1	coils of worsted yarn
skier	n	1:1	someone who skis
skiff	n	1:1	any of various small boats propelled by oars or by sails or by a motor
skill	n	2:1	an ability that has been acquired by training
skill	n	2:2	ability to produce solutions in some problem domain
skimp	v	4:1	work hastily or carelessly; deal with inadequately and superficially
skimp	v	4:2	limit in quality or quantity
skimp	v	4:3	subsist on a meager allowance
skimp	v	4:4	supply sparingly and with restricted quantities
skink	n	1:1	alert agile lizard with reduced limbs and an elongated body covered with shiny scales; more dependent on moisture than most lizards; found in tropical regions worldwide
skint	s	1:1	lacking funds
skirl	n	3:1	the sound of (the chanter of) a bagpipe
skirl	v	3:2	make a shrill, wailing sound
skirl	v	3:3	play the bagpipes
skirt	n	8:1	cloth covering that forms the part of a garment below the waist
skirt	n	8:2	a garment hanging from the waist; worn mainly by girls and women
skirt	n	8:3	(Fungi) a remnant of the partial veil that in mature mushrooms surrounds the stem like a collar
skirt	n	8:4	informal terms for a (young) woman
skirt	v	8:5	avoid or try to avoid fulfilling, answering, or performing (duties, questions, or issues)
skirt	v	8:6	pass around or about; move along the border
skirt	v	8:7	form the edge of
skirt	v	8:8	extend on all sides of simultaneously; encircle
skive	v	1:1	remove the surface of
skulk	v	3:1	lie in wait, lie in ambush, behave in a sneaky and secretive manner
skulk	v	3:2	avoid responsibilities and duties, e.g., by pretending to be ill
skulk	v	3:3	move furtively
skull	n	1:1	the bony skeleton of the head of vertebrates
skunk	n	5:1	a person who is deemed to be despicable or contemptible
skunk	n	5:2	a defeat in a game where one side fails to score
skunk	n	5:3	street names for marijuana
skunk	n	5:4	American musteline mammal typically ejecting an intensely malodorous fluid when startled; in some classifications put in a separate subfamily Mephitinae
skunk	v	5:5	defeat by a lurch
skype	v	1:1	to communicate using Skype or similar web conference software
slack	s	17:1	not tense or taut
slack	s	17:2	flowing with little speed as e.g. at the turning of the tide
slack	s	17:3	lacking in rigor or strictness
slack	n	17:4	dust consisting of a mixture of small coal fragments and coal dust and dirt that sifts out when coal is passed over a sieve
slack	n	17:5	a noticeable deterioration in performance or quality
slack	n	17:6	a stretch of water without current or movement
slack	n	17:7	a soft wet area of low-lying land that sinks underfoot
slack	n	17:8	the quality of being loose (not taut)
slack	n	17:9	a cord or rope or cable that is hanging loosely
slack	v	17:10	avoid responsibilities and work, be idle
slack	v	17:11	be inattentive to, or neglect
slack	v	17:12	release tension on
slack	v	17:13	make less active or fast
slack	v	17:14	become slow or slower
slack	v	17:15	make less active or intense
slack	v	17:16	become less in amount or intensity
slack	v	17:17	cause to heat and crumble by treatment with water
slain	s	5:1	killed; ‘slain’ is formal or literary as in ‘slain warriors’
slain	n	5:2	people who have been slain (as in battle)
slain	v	5:3	kill intentionally and with premeditation
slain	v	5:4	to succeed greatly
slain	v	5:5	be excellent or outstanding
slake	v	3:1	satisfy (thirst)
slake	v	3:2	make less active or intense
slake	v	3:3	cause to heat and crumble by treatment with water
slang	n	5:1	informal language consisting of words and expressions that are not considered appropriate for formal occasions; often vituperative or vulgar
slang	n	5:2	a characteristic language of a particular group (as among thieves)
slang	v	5:3	use slang or vulgar language
slang	v	5:4	fool or hoax
slang	v	5:5	abuse with coarse language
slant	n	6:1	a biased way of looking at or presenting something
slant	n	6:2	degree of deviation from a horizontal plane
slant	v	6:3	lie obliquely
slant	v	6:4	present with a bias
slant	v	6:5	to incline or bend from a vertical position
slant	v	6:6	heel over
slash	n	9:1	a wound made by cutting
slash	n	9:2	an open tract of land in a forest that is strewn with debris from logging (or fire or wind)
slash	n	9:3	a punctuation mark (‘/’) used to separate related items of information
slash	n	9:4	a strong sweeping cut made with a sharp instrument
slash	v	9:5	cut with sweeping strokes; as with an ax or machete
slash	v	9:6	beat severely with a whip or rod
slash	v	9:7	cut open
slash	v	9:8	cut drastically
slash	v	9:9	move or stir about violently
slate	n	7:1	(formerly) a writing tablet made of slate
slate	n	7:2	thin layers of rock used for roofing
slate	n	7:3	a fine-grained metamorphic rock that can be split into thin layers
slate	n	7:4	a list of candidates nominated by a political party to run for election to public offices
slate	v	7:5	designate or schedule
slate	v	7:6	enter on a list or slate for an election
slate	v	7:7	cover with slate
slaty	s	1:1	of the color of slate or granite
slave	n	4:1	a person who is owned by someone
slave	n	4:2	someone who works as hard as a slave
slave	n	4:3	someone entirely dominated by some influence or person
slave	v	4:4	work very hard, like a slave
sleek	s	4:1	well-groomed and neatly tailored; especially too well-groomed
sleek	s	4:2	designed or arranged to offer the least resistance to fluid flow
sleek	s	4:3	having a smooth, gleaming surface reflecting light; being of a smooth, soft and lustrous quality, resembling silk
sleek	v	4:4	make slick or smooth
sleep	n	6:1	a natural and periodic state of rest during which consciousness of the world is suspended
sleep	n	6:2	a torpid state resembling deep sleep
sleep	n	6:3	a period of time spent sleeping
sleep	n	6:4	euphemisms for death (based on an analogy between lying in a bed and in a tomb)
sleep	v	6:5	be asleep
sleep	v	6:6	be able to accommodate for sleeping
sleet	n	2:1	partially melted snow (or a mixture of rain and snow)
sleet	v	2:2	precipitate as a mixture of rain and snow
slept	v	2:1	be asleep
slept	v	2:2	be able to accommodate for sleeping
slews	n	1:1	a large number or amount
slice	n	10:1	a share of something
slice	n	10:2	a serving that has been cut from a larger portion
slice	n	10:3	a wound made by cutting
slice	n	10:4	a golf shot that curves to the right for a right-handed golfer
slice	n	10:5	a thin flat piece cut off of some object
slice	n	10:6	a spatula for spreading paint or ink
slice	v	10:7	make a clean cut through
slice	v	10:8	hit a ball and put a spin on it so that it travels in a different direction
slice	v	10:9	cut into slices
slice	v	10:10	hit a ball so that it causes a backspin
slick	s	11:1	made slick by e.g. ice or grease
slick	s	11:2	superficially impressive, but lacking depth and attention to the true complexities of a subject
slick	s	11:3	having only superficial plausibility
slick	s	11:4	having a smooth, gleaming surface reflecting light; being of a smooth, soft and lustrous quality, resembling silk
slick	s	11:5	marked by skill in deception
slick	n	11:6	a slippery smoothness
slick	n	11:7	a magazine printed on good quality paper
slick	n	11:8	a film of oil or garbage floating on top of water
slick	n	11:9	a trowel used to make a surface slick
slick	v	11:10	make slick or smooth
slick	v	11:11	give a smooth and glossy appearance
slide	n	10:1	a small flat rectangular piece of glass on which specimens can be mounted for microscopic study
slide	n	10:2	(geology) the descent of a large mass of earth or rocks or snow etc.
slide	n	10:3	(music) rapid sliding up or down the musical scale
slide	n	10:4	plaything consisting of a sloping chute down which children can slide
slide	n	10:5	the act of moving smoothly along a surface while remaining in contact with it
slide	n	10:6	a transparency mounted in a frame; viewed with a slide projector
slide	n	10:7	sloping channel through which things can descend
slide	v	10:8	move obliquely or sideways, usually in an uncontrolled manner
slide	v	10:9	to pass or move unobtrusively or smoothly
slide	v	10:10	move smoothly along a surface
slier	s	1:1	marked by skill in deception
slime	n	2:1	any thick, viscous matter
slime	v	2:2	cover or stain with slime
slimy	s	2:1	covered with or resembling slime
slimy	s	2:2	morally reprehensible
sling	n	9:1	a highball with liquor and water with sugar and lemon or lime juice
sling	n	9:2	a plaything consisting of a Y-shaped stick with elastic between the arms; used to propel small stones
sling	n	9:3	a shoe that has a strap that wraps around the heel
sling	n	9:4	a simple weapon consisting of a looped strap in which a projectile is whirled and then released
sling	n	9:5	bandage to support an injured forearm; consisting of a wide triangular piece of cloth hanging from around the neck
sling	v	9:6	hurl as if with a sling
sling	v	9:7	hang loosely or freely; let swing
sling	v	9:8	move with a sling
sling	v	9:9	hold or carry in a sling
slink	v	1:1	walk stealthily
sloop	n	1:1	a sailing vessel with a single mast set about one third of the boat's length aft of the bow
slope	n	3:1	an elevated geological formation
slope	n	3:2	the property possessed by a line or surface that departs from the horizontal
slope	v	3:3	be at an angle
slops	n	2:1	wet feed (especially for pigs) consisting of mostly kitchen waste mixed with water or skimmed or sour milk
slops	n	2:2	cheap clothing (as formerly issued to sailors in Britain)
slosh	v	3:1	make a splashing sound
slosh	v	3:2	walk through mud or mire
slosh	v	3:3	spill or splash copiously or clumsily
sloth	n	3:1	a disinclination to work or exert yourself
sloth	n	3:2	any of several slow-moving arboreal mammals of South America and Central America; they hang from branches back downward and feed on leaves and fruits
sloth	n	3:3	apathy and inactivity in the practice of virtue (personified as one of the deadly sins)
slump	n	6:1	a noticeable deterioration in performance or quality
slump	n	6:2	a long-term economic state characterized by unemployment and low prices and low levels of trade and investment
slump	v	6:3	assume a drooping posture or carriage
slump	v	6:4	fall or sink heavily
slump	v	6:5	fall heavily or suddenly; decline markedly
slump	v	6:6	fall in value
slung	v	4:1	hurl as if with a sling
slung	v	4:2	hang loosely or freely; let swing
slung	v	4:3	move with a sling
slung	v	4:4	hold or carry in a sling
slunk	v	1:1	walk stealthily
slurp	v	1:1	eat noisily
slush	n	3:1	partially melted snow
slush	v	3:2	make a splashing sound
slush	v	3:3	spill or splash copiously or clumsily
slyer	s	1:1	marked by skill in deception
slyly	r	1:1	in an subtle, cunning manner
smack	n	12:1	a blow from a flat object (as an open hand)
smack	n	12:2	the taste experience when a savoury condiment is taken into the mouth
smack	n	12:3	a sailing ship (usually rigged like a sloop or cutter) used in fishing and sailing along the coast
smack	n	12:4	street names for heroin
smack	n	12:5	an enthusiastic kiss
smack	n	12:6	the act of smacking something; a blow delivered with an open hand
smack	r	12:7	directly
smack	v	12:8	deliver a hard blow to
smack	v	12:9	have an element suggestive (of something)
smack	v	12:10	have a distinctive or characteristic taste
smack	v	12:11	kiss lightly
smack	v	12:12	press (the lips) together and open (the lips) noisily, as in eating
small	a	13:1	limited or below average in number or quantity or magnitude or extent
small	s	13:2	relatively moderate, limited, or small
small	s	13:3	(of children and animals) young, immature
small	s	13:4	slight or limited; especially in degree or intensity or scope
small	s	13:5	low or inferior in station or quality
small	s	13:6	lowercase
small	s	13:7	(of a voice) faint
small	s	13:8	have fine or very small constituent particles
small	s	13:9	not large but sufficient in size or amount
small	s	13:10	made to seem smaller or less (especially in worth)
small	n	13:11	the slender part of the back
small	n	13:12	a garment size for a small person
small	r	13:13	on a small scale
smarm	n	1:1	excessive but superficial compliments given with affected charm
smart	a	9:1	showing mental alertness and calculation and resourcefulness
smart	s	9:2	elegant and stylish
smart	s	9:3	characterized by quickness and ease in learning
smart	s	9:4	improperly forward or bold
smart	s	9:5	painfully severe
smart	s	9:6	quick and brisk
smart	s	9:7	capable of independent and apparently intelligent action
smart	n	9:8	a kind of pain such as that caused by a wound or a burn or a sore
smart	v	9:9	be the source of pain
smash	n	16:1	a vigorous blow
smash	n	16:2	a serious collision (especially of motor vehicles)
smash	n	16:3	a hard return hitting the tennis ball above your head
smash	n	16:4	the act of colliding with something
smash	n	16:5	a conspicuous success
smash	r	16:6	with a loud crash
smash	v	16:7	hit with great force
smash	v	16:8	break into pieces, as by striking or knocking over
smash	v	16:9	reduce to bankruptcy
smash	v	16:10	hit violently
smash	v	16:11	humiliate or depress completely
smash	v	16:12	damage or destroy as if by violence
smash	v	16:13	hit (a tennis ball) in a powerful overhead stroke
smash	v	16:14	collide or strike violently and suddenly
smash	v	16:15	overthrow or destroy (something considered evil or harmful)
smash	v	16:16	break suddenly into pieces, as from a violent blow
smear	n	8:1	slanderous defamation
smear	n	8:2	a thin tissue or blood sample spread on a glass slide and stained for cytologic examination and diagnosis under a microscope
smear	n	8:3	a blemish made by dirt
smear	n	8:4	an act that brings discredit to the person who does it
smear	v	8:5	stain by smearing or daubing with a dirty substance
smear	v	8:6	make a smudge on; soil by smudging
smear	v	8:7	cover (a surface) by smearing (a substance) over it
smear	v	8:8	charge falsely or with malicious intent; attack the good name and reputation of someone
smell	n	10:1	the sensation that results when olfactory receptors in the nose are stimulated by particular chemicals in gaseous form
smell	n	10:2	any property detected by the olfactory system
smell	n	10:3	the general atmosphere of a place or situation and the effect that it has on people
smell	n	10:4	the faculty that enables us to distinguish scents
smell	n	10:5	the act of perceiving the odor of something
smell	v	10:6	inhale the odor of; perceive by the olfactory sense
smell	v	10:7	emit an odor
smell	v	10:8	smell bad
smell	v	10:9	have an element suggestive (of something)
smell	v	10:10	become aware of not through the senses but instinctively
smelt	v	8:1	inhale the odor of; perceive by the olfactory sense
smelt	v	8:2	emit an odor
smelt	v	8:3	smell bad
smelt	v	8:4	have an element suggestive (of something)
smelt	v	8:5	become aware of not through the senses but instinctively
smelt	n	8:6	small cold-water silvery fish; migrate between salt and fresh water
smelt	n	8:7	small trout-like silvery marine or freshwater food fishes of cold northern waters
smelt	v	8:8	extract (metals) by heating
smile	n	3:1	a facial expression characterized by turning up the corners of the mouth; usually shows pleasure or amusement
smile	v	3:2	change one's facial expression by spreading the lips, often to signal pleasure
smile	v	3:3	express with a smile
smilo	n	1:1	perennial mountain rice native to Mediterranean region and introduced into North America
smirk	n	2:1	a smile expressing smugness or scorn instead of pleasure
smirk	v	2:2	smile affectedly or derisively
smite	v	3:1	inflict a heavy blow on, with the hand, a tool, or a weapon
smite	v	3:2	affect suddenly with deep feeling
smite	v	3:3	cause physical pain or suffering in
smith	n	10:1	Rhodesian statesman who declared independence of Zimbabwe from Great Britain (born in 1919)
smith	n	10:2	United States sculptor (1906-1965)
smith	n	10:3	United States singer noted for her rendition of patriotic songs (1909-1986)
smith	n	10:4	United States suffragist who refused to pay taxes until she could vote (1792-1886)
smith	n	10:5	United States blues singer (1894-1937)
smith	n	10:6	religious leader who founded the Mormon Church in 1830 (1805-1844)
smith	n	10:7	English explorer who helped found the colony at Jamestown, Virginia; was said to have been saved by Pocahontas (1580-1631)
smith	n	10:8	Scottish economist who advocated private enterprise and free trade (1723-1790)
smith	n	10:9	someone who works at something specified
smith	n	10:10	someone who works metal (especially by hammering it when it is hot and malleable)
smock	n	2:1	a loose coverall (coat or frock) reaching down to the ankles
smock	v	2:2	embellish by sewing in straight lines crossing each other diagonally
smoke	n	10:1	a cloud of fine particles suspended in a gas
smoke	n	10:2	a hot vapor containing fine particles of carbon being produced by combustion
smoke	n	10:3	an indication of some hidden activity
smoke	n	10:4	something with no concrete substance
smoke	n	10:5	tobacco leaves that have been made into a cylinder
smoke	n	10:6	street names for marijuana
smoke	n	10:7	the act of smoking tobacco or other substances
smoke	n	10:8	(baseball) a pitch thrown with maximum velocity
smoke	v	10:9	inhale and exhale smoke from cigarettes, cigars, pipes
smoke	v	10:10	emit a cloud of fine particles
smoky	a	2:1	marked by or emitting or filled with smoke
smoky	s	2:2	tasting of smoke
smote	v	3:1	inflict a heavy blow on, with the hand, a tool, or a weapon
smote	v	3:2	affect suddenly with deep feeling
smote	v	3:3	cause physical pain or suffering in
snack	n	2:1	a light informal meal
snack	v	2:2	eat a snack; eat lightly
snafu	s	3:1	snarled or stalled in complete confusion
snafu	n	3:2	an acronym often used by soldiers in World War II: situation normal all fucked up
snafu	v	3:3	cause to be in a state of complete confusion
snail	n	3:1	freshwater or marine or terrestrial gastropod mollusk usually having an external enclosing spiral shell
snail	n	3:2	edible terrestrial snail usually served in the shell with a sauce of melted butter and garlic
snail	v	3:3	gather snails
snake	n	9:1	a tributary of the Columbia River that rises in Wyoming and flows westward; discovered in 1805 by the Lewis and Clark Expedition
snake	n	9:2	a long faint constellation in the Southern Hemisphere near the equator stretching between Virgo and Cancer
snake	n	9:3	limbless scaly elongate reptile; some are venomous
snake	n	9:4	a deceitful or treacherous person
snake	n	9:5	something long, thin, and flexible that resembles a snake
snake	n	9:6	a long flexible steel coil for dislodging stoppages in curved pipes
snake	v	9:7	move smoothly and sinuously, like a snake
snake	v	9:8	form a snake-like pattern
snake	v	9:9	move along a winding path
snaky	s	1:1	resembling a serpent in form
snare	n	7:1	something (often something deceptively attractive) that catches you unawares
snare	n	7:2	a small drum with two heads and a snare stretched across the lower head
snare	n	7:3	a surgical instrument consisting of wire hoop that can be drawn tight around the base of polyps or small tumors to sever them; used especially in body cavities
snare	n	7:4	strings stretched across the lower head of a snare drum; they make a rattling sound when the drum is hit
snare	n	7:5	a trap for birds or small mammals; often has a slip noose
snare	v	7:6	catch in or as if in a trap
snare	v	7:7	entice and trap
snarf	v	1:1	make off with belongings of others
snarl	n	7:1	a vicious angry growl
snarl	n	7:2	an angry vicious expression
snarl	n	7:3	something jumbled or confused
snarl	v	7:4	utter in an angry, sharp, or abrupt tone
snarl	v	7:5	make a snarling noise or move with a snarling noise
snarl	v	7:6	twist together or entwine into a confusing mass
snarl	v	7:7	make more complicated or confused through entanglements
sneak	s	8:1	marked by quiet and caution and secrecy; taking pains to avoid being observed
sneak	n	8:2	a person who is regarded as underhanded and furtive and contemptible
sneak	n	8:3	someone who prowls or sneaks about; usually with unlawful intentions
sneak	n	8:4	someone acting as an informer or decoy for the police
sneak	v	8:5	to go stealthily or furtively
sneak	v	8:6	put, bring, or take in a secretive or furtive manner
sneak	v	8:7	make off with belongings of others
sneak	v	8:8	pass on stealthily
sneer	n	4:1	a facial expression of contempt or scorn; the upper lip curls
sneer	n	4:2	a contemptuous or scornful remark
sneer	v	4:3	express through a scornful smile
sneer	v	4:4	smile contemptuously
snick	n	4:1	a small cut
snick	n	4:2	a glancing contact with the ball off the edge of the cricket bat
snick	v	4:3	hit a glancing blow with the edge of the bat
snick	v	4:4	cut slightly, with a razor
snide	s	1:1	expressive of contempt
sniff	n	3:1	sensing an odor by inhaling through the nose
sniff	v	3:2	perceive by inhaling through the nose
sniff	v	3:3	inhale audibly through the nose
snipe	n	5:1	Old or New World straight-billed game bird of the sandpiper family; of marshy areas; similar to the woodcocks
snipe	n	5:2	a gunshot from a concealed location
snipe	v	5:3	hunt or shoot snipe
snipe	v	5:4	aim and shoot with great precision
snipe	v	5:5	attack in speech or writing
snips	n	1:1	(plural) hand shears for cutting sheet metal
snoek	n	1:1	a large marine food fish common on the coasts of Australia, New Zealand, and southern Africa
snood	n	1:1	an ornamental net in the shape of a bag that confines a woman's hair; pins or ties at the back of the head
snook	n	1:1	large tropical American food and game fishes of coastal and brackish waters; resemble pike
snoop	n	2:1	a spy who makes uninvited inquiries into the private affairs of others
snoop	v	2:2	watch, observe, or inquire secretly
snoot	n	2:1	a person regarded as arrogant and annoying
snoot	n	2:2	informal terms for the nose
snore	n	3:1	the rattling noise produced when snoring
snore	n	3:2	the act of snoring or producing a snoring sound
snore	v	3:3	breathe noisily during one's sleep
snort	n	6:1	a disrespectful laugh
snort	n	6:2	a cry or noise made to express displeasure or contempt
snort	v	6:3	indicate contempt by breathing noisily and forcefully through the nose
