word	pos	ss:n	definition
light	a	48:2	of comparatively little physical weight or density
light	a	48:3	(used of color) having a relatively small amount of coloring agent
light	a	48:4	of the military or industry; using (or being) relatively small or light arms or equipment
light	a	48:5	not great in degree or quantity or number
light	a	48:6	psychologically light; especially free from sadness or troubles
light	a	48:7	characterized by or emitting light
light	s	48:8	(used of vowels or syllables) pronounced with little or no stress
light	s	48:9	easily assimilated in the alimentary canal; not rich or heavily seasoned
light	s	48:10	(used of soil) loose and large-grained in consistency
light	s	48:11	(of sound or color) free from anything that dulls or dims
light	s	48:12	moving easily and quickly; nimble
light	s	48:13	demanding little effort; not burdensome
light	a	48:14	of little intensity or power or force
light	a	48:15	(physics, chemistry) not having atomic weight greater than average
light	s	48:16	weak and likely to lose consciousness
light	s	48:17	very thin and insubstantial
light	s	48:18	marked by temperance in indulgence
light	s	48:19	less than the correct or legal or full amount often deliberately so
light	s	48:20	having little importance
light	s	48:21	intended primarily as entertainment; not serious or profound
light	s	48:22	silly or trivial
light	s	48:23	designed for ease of movement or to carry little weight
light	s	48:24	having relatively few calories
light	s	48:25	(of sleep) easily disturbed
light	s	48:26	casual and unrestrained in sexual behavior
light	n	48:27	(physics) electromagnetic radiation that can produce a visual sensation
light	n	48:28	any device serving as a source of illumination
light	n	48:29	a particular perspective or aspect of a situation
light	n	48:30	the quality of being luminous; emitting or reflecting light
light	n	48:31	an illuminated area
light	n	48:32	a condition of spiritual awareness; divine illumination
light	n	48:33	the visual effect of illumination on objects or scenes as created in pictures
light	n	48:34	a person regarded very fondly
light	n	48:35	having abundant light or illumination
light	n	48:36	mental understanding as an enlightening experience
light	n	48:37	merriment expressed by a brightness or gleam or animation of countenance
light	n	48:38	public awareness
light	n	48:39	a visual warning signal
light	n	48:40	a device for lighting or igniting fuel or charges or fires
light	r	48:41	with few burdens
light	v	48:42	introduce light into
light	v	48:43	begin to smoke
light	v	48:44	to come to rest, settle
light	v	48:45	cause to start burning; subject to fire or great heat
light	v	48:46	fall to somebody by assignment or lot; passed
light	v	48:47	alight from (a horse)
light	v	48:48	start or maintain a fire in
ligne	n	1:1	a linear unit (1/40 inch) used to measure diameter of buttons
liked	a	1:1	found pleasant or attractive; often used as a combining form
liken	v	1:1	consider or describe as similar, equal, or analogous
lilac	s	2:1	of a pale purple color
lilac	n	2:2	any of various plants of the genus Syringa having large panicles of usually fragrant flowers
liman	n	1:1	a long narrow lagoon near the mouth of a river
limbi	n	1:1	a border or edge of any of various body parts distinguished by color or structure
limbo	n	3:1	the state of being disregarded or forgotten
limbo	n	3:2	an imaginary place for lost or neglected things
limbo	n	3:3	(theology) in Roman Catholicism, the place of unbaptized but innocent or righteous souls (such as infants and virtuous individuals)
limen	n	1:1	the smallest detectable sensation
limey	n	1:1	a man of English descent
limit	n	9:1	the greatest possible degree of something
limit	n	9:2	final or latest limiting point
limit	n	9:3	as far as something can go
limit	n	9:4	the boundary of a specific area
limit	n	9:5	the mathematical value toward which a function goes as the independent variable approaches infinity
limit	n	9:6	the greatest amount of something that is possible or allowed
limit	v	9:7	place limits on (extent or amount or access)
limit	v	9:8	restrict or confine within limits
limit	v	9:9	decide upon or fix definitely
limpa	n	1:1	a rye bread made with molasses or brown sugar
linac	n	1:1	ions are accelerated along a linear path by voltage differences on electrodes along the path
lindy	n	1:1	an energetic American dance that was popular in the 1930s (probably named for the aviator Charles Lindbergh)
lined	s	3:1	bordered by a line of things
lined	s	3:2	(used especially of skin) marked by lines or seams
lined	a	3:3	having a lining or a liner; often used in combination
linen	n	3:1	a fabric woven with fibers from the flax plant
linen	n	3:2	a high-quality paper made of linen fibers or with a linen finish
linen	n	3:3	white goods or clothing made with linen cloth
liner	n	4:1	(baseball) a hit that flies straight out from the batter
liner	n	4:2	a protective covering that protects an inside surface
liner	n	4:3	a piece of cloth that is used as the inside surface of a garment
liner	n	4:4	a large commercial ship (especially one that carries passengers on a regular schedule)
lingo	n	1:1	a characteristic language of a particular group (as among thieves)
linin	n	1:1	an obsolete term for the network of viscous material in the cell nucleus on which the chromatin granules were thought to be suspended
links	n	1:1	a golf course that is built on sandy ground near a shore
lipid	n	1:1	an oily organic compound insoluble in water but soluble in organic solvents; essential structural component of living cells (along with proteins and carbohydrates)
lisle	n	2:1	a fabric woven with lisle thread
lisle	n	2:2	a strong tightly twisted cotton thread (usually made of long-staple cotton)
litai	n	2:1	the humanistic study of a body of literature
litai	n	2:2	the basic unit of money in Lithuania
litas	n	1:1	the basic unit of money in Lithuania
liter	n	1:1	a metric unit of capacity, formerly defined as the volume of one kilogram of pure water under standard conditions; now equal to 1,000 cubic centimeters (or approximately 1.75 pints)
lithe	s	1:1	gracefully thin and bending and moving with ease
litre	n	1:1	a metric unit of capacity, formerly defined as the volume of one kilogram of pure water under standard conditions; now equal to 1,000 cubic centimeters (or approximately 1.75 pints)
liven	v	1:1	make lively
liver	s	5:1	having a reddish-brown color
liver	n	5:2	large and complicated reddish-brown glandular organ located in the upper right portion of the abdominal cavity; secretes bile and functions in metabolism of protein and carbohydrate and fat; synthesizes substances involved in the clotting of the blood; synthesizes vitamin A; detoxifies poisonous substances and breaks down worn-out erythrocytes
liver	n	5:3	liver of an animal used as meat
liver	n	5:4	a person who has a special life style
liver	n	5:5	someone who lives in a place
lives	n	14:1	a characteristic state or mode of living
lives	n	14:2	the experience of being alive; the course of human events and activities
lives	n	14:3	the course of existence of an individual; the actions and events that occur in living
lives	n	14:4	the condition of living or the state of being alive
lives	n	14:5	the period during which something is functional (as between birth and death)
lives	n	14:6	the period between birth and the present time
lives	n	14:7	the period from the present until death
lives	n	14:8	a living person
lives	n	14:9	animation and energy in action or expression
lives	n	14:10	living things collectively
lives	n	14:11	the organic phenomenon that distinguishes living organisms from nonliving ones
lives	n	14:12	an account of the series of events making up a person's life
lives	n	14:13	a motive for living
lives	n	14:14	a prison term lasting as long as the prisoner lives
livid	s	4:1	anemic looking from illness or emotion
livid	s	4:2	(of a light) imparting a deathlike luminosity
livid	s	4:3	furiously angry
livid	s	4:4	discolored by coagulation of blood beneath the skin
llama	n	1:1	wild or domesticated South American cud-chewing animal related to camels but smaller and lacking a hump
llano	n	1:1	an extensive grassy and nearly treeless plain (especially in Latin America)
loach	n	1:1	slender freshwater fishes of Eurasia and Africa resembling catfishes
loads	n	1:1	a large number or amount
loamy	a	1:1	consisting of or having the character of loam
loasa	n	1:1	any of various perennial South American plants of the genus Loasa having stinging hairs and showy white or yellow or reddish-orange flowers
loath	s	2:1	unwillingness to do something contrary to your custom
loath	s	2:2	(usually followed by ‘to’) strongly opposed
lobar	a	1:1	of or relating to or affecting a lobe
lobby	n	4:1	a large entrance or reception room or area
lobby	n	4:2	the people who support some common cause or business or principle or sectional interest
lobby	n	4:3	an interest group that tries to influence legislators or bureaucrats to act in their favor, typically through lobbying
lobby	v	4:4	detain in conversation by or as if by holding on to the outer garments of; as for political or economic favors
lobed	s	1:1	having deeply indented margins but with lobes not entirely separate from each other
local	a	5:1	relating to or applicable to or concerned with the administration of a city or town or district rather than a larger area
local	a	5:2	of or belonging to or characteristic of a particular locality or neighborhood
local	a	5:3	affecting only a restricted part or area of the body
local	n	5:4	public transport consisting of a bus or train that stops at all stations or stops
local	n	5:5	anesthetic that numbs a particular area of the body
locum	n	1:1	someone (physician or clergyman) who substitutes temporarily for another member of the same profession
locus	n	3:1	the scene of any event or action (especially the place of a meeting)
locus	n	3:2	the specific site of a particular gene on its chromosome
locus	n	3:3	the set of all points or lines that satisfy or are determined by specific conditions
lodge	n	10:1	English physicist who studied electromagnetic radiation and was a pioneer of radiotelegraphy (1851-1940)
lodge	n	10:2	a formal association of people with similar interests
lodge	n	10:3	small house at the entrance to the grounds of a country mansion; usually occupied by a gatekeeper or gardener
lodge	n	10:4	a small (rustic) house used as a temporary shelter
lodge	n	10:5	any of various Native American dwellings
lodge	n	10:6	a hotel providing overnight lodging for travelers
lodge	v	10:7	be a lodger; stay temporarily
lodge	v	10:8	put, fix, force, or implant
lodge	v	10:9	file a formal charge against
lodge	v	10:10	provide housing for
loess	n	1:1	a fine-grained unstratified accumulation of clay and silt deposited by the wind
lofty	s	3:1	of high moral or intellectual value; elevated in nature or style
lofty	s	3:2	of imposing height; especially standing out above others
lofty	s	3:3	having or displaying great dignity or nobility
logia	n	1:1	a saying of Jesus that is regarded as authentic although it is not recorded in the Gospels
logic	n	5:1	the branch of philosophy that analyzes inference
logic	n	5:2	reasoned and reasonable judgment
logic	n	5:3	the principles that guide reasoning within a given field or situation
logic	n	5:4	the system of operations performed by a computer that underlies the machine's representation of logical operations
logic	n	5:5	a system of reasoning
lohan	n	1:1	a Buddhist who has attained nirvana
loins	n	2:1	the lower part of the abdomen just above the external genital organs
loins	n	2:2	the region of the hips and groin and lower abdomen
lolly	n	2:1	informal terms for money
lolly	n	2:2	ice cream or water ice on a small wooden stick
loner	n	1:1	a person who avoids the company or assistance of others
loofa	n	1:1	the dried fibrous part of the fruit of a plant of the genus Luffa; used as a washing sponge or strainer
loony	s	2:1	informal or slang terms for mentally irregular
loony	n	2:2	someone deranged and possibly dangerous
loopy	a	2:1	consisting of or covered with or having loops
loopy	s	2:2	informal or slang terms for mentally irregular
loose	a	18:1	not compact or dense in structure or arrangement
loose	s	18:2	(of a ball in sport) not in the possession or control of any player
loose	a	18:3	not tight; not closely constrained or constricted or constricting
loose	s	18:4	not officially recognized or controlled
loose	s	18:5	not literal
loose	s	18:6	emptying easily or excessively
loose	a	18:7	not affixed
loose	s	18:8	not tense or taut
loose	s	18:9	(of textures) full of small openings or gaps
loose	s	18:10	lacking a sense of restraint or responsibility
loose	s	18:11	not carefully arranged in a package
loose	s	18:12	having escaped, especially from confinement
loose	s	18:13	casual and unrestrained in sexual behavior
loose	r	18:14	without restraint
loose	v	18:15	grant freedom to; free from confinement
loose	v	18:16	turn loose or free from restraint
loose	v	18:17	make loose or looser
loose	v	18:18	become loose or looser or less tight
lorry	n	2:1	a large low horse-drawn wagon without sides
lorry	n	2:2	a large truck designed to carry heavy loads; usually without sides
loser	n	3:1	a contestant who loses the contest
loser	n	3:2	a person with a record of failing; someone who loses consistently
loser	n	3:3	a gambler who loses a bet
lossy	a	1:1	characterized by or causing dissipation of energy
lotic	a	1:1	of or relating to or living in actively moving water
lotte	n	1:1	fishes having large mouths with a wormlike filament attached for luring prey
lotto	n	1:1	a game in which numbered balls are drawn at random and players cover the corresponding numbers on their cards
lotus	n	3:1	annual or perennial herbs or subshrubs
lotus	n	3:2	native to eastern Asia; widely cultivated for its large pink or white flowers
lotus	n	3:3	white Egyptian lotus: water lily of Egypt to southeastern Africa; held sacred by the Egyptians
lough	n	2:1	a long narrow (nearly landlocked) cove in Ireland
lough	n	2:2	Irish word for a lake
loupe	n	1:1	small magnifying glass (usually set in an eyepiece) used by jewelers and horologists
louse	n	4:1	wingless usually flattened bloodsucking insect parasitic on warm-blooded animals
louse	n	4:2	a person who has a nasty or unethical character undeserving of respect
louse	n	4:3	any of several small insects especially aphids that feed by sucking the juices from plants
louse	n	4:4	wingless insect with mouth parts adapted for biting; mostly parasitic on birds
lousy	s	3:1	very bad
lousy	s	3:2	infested with lice
lousy	s	3:3	vile; despicable
loved	a	1:1	held dear
lover	n	3:1	a person who loves someone or is loved by someone
lover	n	3:2	an ardent follower and admirer
lover	n	3:3	a significant other to whom you are not related by marriage
lowan	n	1:1	Australian mound bird; incubates eggs naturally in sandy mounds
lower	a	7:1	the bottom one of two
lower	n	7:2	the lower of two berths
lower	v	7:3	move something or somebody to a lower position
lower	v	7:4	set lower
lower	v	7:5	make lower or quieter
lower	v	7:6	cause to drop or sink
lower	v	7:7	look angry or sullen, wrinkle one's forehead, as if to signal disapproval
lowly	s	4:1	low or inferior in station or quality
lowly	s	4:2	inferior in rank or status
lowly	s	4:3	used of unskilled work (especially domestic work)
lowly	s	4:4	of low birth or station (‘base’ is archaic in this sense)
loyal	a	3:1	steadfast in allegiance or duty
loyal	a	3:2	inspired by love for your country
loyal	s	3:3	unwavering in devotion to friend or vow or cause
lucid	s	4:1	(of language) transparently clear; easily understandable
lucid	s	4:2	having a clear mind
lucid	s	4:3	capable of thinking and expressing yourself in a clear and consistent manner
lucid	s	4:4	transmitting light; able to be seen through with clarity
lucky	s	3:1	occurring by chance
lucky	a	3:2	having or bringing good fortune
lucky	s	3:3	presaging or likely to bring good luck or a good outcome
lucre	n	2:1	informal terms for money
lucre	n	2:2	the excess of revenues over outlays in a given period of time (including depreciation and other non-cash expenses)
ludic	s	1:1	relating to play or playfulness
luffa	n	2:1	the dried fibrous part of the fruit of a plant of the genus Luffa; used as a washing sponge or strainer
luffa	n	2:2	any of several tropical annual climbers having large yellow flowers and edible young fruits; grown commercially for the mature fruit's dried fibrous interior that is used as a sponge
luger	n	2:1	a German semiautomatic pistol
luger	n	2:2	someone who races the luge
lumbi	n	1:1	either side of the backbone between the hipbone and the ribs in humans as well as quadrupeds
lumen	n	2:1	a unit of luminous flux equal to the amount of light given out through a solid angle of 1 steradian by a point source of 1 candela intensity radiating uniformly in all directions
lumen	n	2:2	a cavity or passage in a tubular organ
lumma	n	1:1	100 lumma equal 1 dram in Armenia
lumpy	s	2:1	like or containing small sticky lumps
lumpy	s	2:2	having lumps; not smooth and even in texture
lunar	a	1:1	of or relating to or associated with the moon
lunch	n	3:1	a midday meal
lunch	v	3:2	take the midday meal
lunch	v	3:3	provide a midday meal for
lunge	n	3:1	the act of moving forward suddenly
lunge	n	3:2	(fencing) an attacking thrust made with one foot forward and the back leg straight and with the sword arm outstretched forward
lunge	v	3:3	make a thrusting forward movement
lungi	n	1:1	a long piece of brightly colored cloth (cotton or silk) used as clothing (a skirt or loincloth or sash etc.) in India and Pakistan and Burma
lupin	n	1:1	any plant of the genus Lupinus; bearing erect spikes of usually purplish-blue flowers
lupus	n	2:1	a constellation in the Southern Hemisphere near Centaurus
lupus	n	2:2	any of several forms of ulcerative skin disease
lurch	n	9:1	an unsteady uneven gait
lurch	n	9:2	a decisive defeat in a game (especially in cribbage)
lurch	n	9:3	abrupt up-and-down motion (as caused by a ship or other conveyance)
lurch	n	9:4	the act of moving forward suddenly
lurch	v	9:5	walk as if unable to control one's movements
lurch	v	9:6	move abruptly
lurch	v	9:7	move slowly and unsteadily
lurch	v	9:8	loiter about, with no apparent aim
lurch	v	9:9	defeat by a lurch
lures	n	3:1	qualities that attract by seeming to promise some kind of reward
lures	n	3:2	anything that serves as an enticement
lures	n	3:3	something used to lure fish or other animals into danger so they can be trapped or killed
lurid	s	4:1	horrible in fierceness or savagery
lurid	s	4:2	glaringly vivid and graphic; marked by sensationalism
lurid	s	4:3	shining with an unnatural red glow as of fire seen through smoke
lurid	s	4:4	ghastly pale
lusty	s	2:1	vigorously passionate
lusty	s	2:2	endowed with or exhibiting great bodily or mental health
lviii	s	1:1	being eight more than fifty
lxiii	s	1:1	being three more than sixty
lxvii	s	1:1	being seven more than sixty
lxxii	s	1:1	being two more than seventy
lxxiv	s	1:1	being four more than seventy
lxxvi	s	1:1	being six more than seventy
lxxxi	s	1:1	being one more than eighty
lxxxv	s	1:1	being five more than eighty
lycee	n	1:1	a school for students intermediate between elementary school and college; usually grades 9 to 12
lying	v	8:1	be located or situated somewhere; occupy a certain position
lying	v	8:2	be lying, be prostrate; be in a horizontal position
lying	v	8:3	originate (in)
lying	v	8:4	be and remain in a particular state or condition
lying	v	8:5	tell an untruth; pretend with intent to deceive
lying	v	8:6	have a place in relation to something else
lying	v	8:7	assume a reclining position
lying	n	8:8	the deliberate act of deviating from the truth
lymph	n	1:1	a thin coagulable fluid (similar to plasma but) containing white blood cells (lymphocytes) and chyle; is conveyed to the blood stream by lymphatic vessels
lynch	v	1:1	kill without legal sanction
lyric	s	7:1	expressing deep emotion
lyric	a	7:2	used of a singer or singing voice that is light in volume and modest in range
lyric	a	7:3	relating to or being musical drama
lyric	a	7:4	of or relating to a category of poetry that expresses emotion (often in a songlike way)
lyric	n	7:5	the text of a popular song or musical-comedy number
lyric	n	7:6	a short poem of songlike quality
lyric	v	7:7	write lyrics for (a song)
lyses	n	2:1	recuperation in which the symptoms of an acute disease gradually subside
lyses	n	2:2	(biochemistry) dissolution or destruction of cells such as blood cells or bacteria
lysin	n	1:1	any substance (such as an antibody) or agent that can cause lysis
lysis	n	2:1	recuperation in which the symptoms of an acute disease gradually subside
lysis	n	2:2	(biochemistry) dissolution or destruction of cells such as blood cells or bacteria
lyssa	n	1:1	an acute viral disease of the nervous system of warm-blooded animals (usually transmitted by the bite of a rabid animal); rabies is fatal if the virus reaches the brain
maare	n	1:1	a flat-bottomed volcanic crater that was formed by an explosion; often filled with water
macaw	n	1:1	long-tailed brilliantly colored parrot of Central America and South America; among the largest and showiest of parrots
macer	n	1:1	an official who carries a mace of office
macho	s	2:1	used of men; markedly masculine in appearance or manner
macho	n	2:2	a male exhibiting or characterized by machismo
macon	n	2:1	a city in central Georgia to the southeast of Atlanta
macon	n	2:2	fine Burgundy wine usually white and dry
macro	s	2:1	very large in scale or scope or capability
macro	n	2:2	a single computer instruction that results in a series of instructions in machine language
madam	n	2:1	a woman of refinement
madam	n	2:2	a woman who runs a house of prostitution
madly	r	3:1	in an ungovernable manner
madly	r	3:2	in an insane manner
madly	r	3:3	(used as intensives) excessively
mafia	n	3:1	a crime syndicate in the United States; organized in families; believed to have important relations to the Sicilian Mafia
mafia	n	3:2	a secret terrorist group in Sicily; originally opposed tyranny but evolved into a criminal organization in the middle of the 19th century
mafia	n	3:3	any tightly knit group of trusted associates
magic	s	3:1	possessing or using or characteristic of or appropriate to supernatural powers
magic	n	3:2	any art that invokes supernatural powers
magic	n	3:3	an illusory feat; considered magical by naive observers
magma	n	1:1	molten rock in the earth's crust
magus	n	2:1	a magician or sorcerer of ancient times
magus	n	2:2	a member of the Zoroastrian priesthood of the ancient Persians
mahoe	n	2:1	shrubby tree widely distributed along tropical shores; yields a light tough wood used for canoe outriggers and a fiber used for cordage and caulk; often cultivated for ornament
mahoe	n	2:2	erect forest tree of Cuba and Jamaica having variably hairy leaves and orange-yellow or orange-red flowers; yields a moderately dense timber for cabinetwork and gunstocks
maize	n	2:1	tall annual cereal grass bearing kernels on large ears: widely cultivated in America in many varieties; the principal cereal in Mexico and Central and South America since pre-Columbian times
maize	n	2:2	a strong yellow color
major	n	13:1	British statesman who was prime minister from 1990 until 1997 (born in 1943)
major	a	13:2	of greater importance or stature or rank
major	a	13:3	greater in scope or effect
major	a	13:4	greater in number or size or amount
major	a	13:5	of the field of academic study in which one concentrates or specializes
major	a	13:6	(of a scale or mode) having half steps between the third and fourth degrees and the seventh and eighth degrees
major	a	13:7	of greater seriousness or danger
major	a	13:8	of full legal age
major	s	13:9	of the elder of two boys with the same family name
major	n	13:10	a commissioned military officer in the United States Army or Air Force or Marines; below lieutenant colonel and above captain
major	n	13:11	a university student who is studying a particular field as the principal subject
major	n	13:12	the principal field of study of a student at a university
major	v	13:13	have as one's principal field of study
maker	n	3:1	terms referring to the Judeo-Christian God
maker	n	3:2	a person who makes things
maker	n	3:3	a business engaged in manufacturing some product
malar	n	1:1	the arch of bone beneath the eye that forms the prominence of the cheek
maleo	n	1:1	Celebes megapode that lays eggs in holes in sandy beaches
malik	n	1:1	the leader of a town or community in some parts of Asia Minor and the Indian subcontinent
mamba	n	1:1	arboreal snake of central and southern Africa whose bite is often fatal
mambo	n	2:1	a Latin American dance similar in rhythm to the rumba
mambo	v	2:2	dance a mambo
mamey	n	2:1	tropical American tree having edible fruit with a leathery rind
mamey	n	2:2	globular or ovoid tropical fruit with thick russet leathery rind and juicy yellow or reddish flesh
mamma	n	2:1	informal terms for a mother
mamma	n	2:2	milk-secreting organ of female mammals
mammy	n	2:1	an offensive term for a Black nursemaid in the southern U.S.
mammy	n	2:2	informal terms for a mother
manat	n	2:1	the basic unit of money in Turkmenistan
manat	n	2:2	the basic unit of money in Azerbaijan
manga	n	1:1	graphic novel that originated in Japan, usually intended for adults and characterized by highly stylized art
mange	n	1:1	a persistent and contagious disease of the skin causing inflammation and itching and loss of hair; affects domestic animals (and sometimes people)
mango	n	2:1	large evergreen tropical tree cultivated for its large oval fruit
mango	n	2:2	large oval tropical fruit having smooth skin, juicy aromatic pulp, and a large hairy seed
mangy	s	1:1	having many worn or threadbare spots in the nap
mania	n	2:1	an irrational but irresistible motive for a belief or action
mania	n	2:2	a mood disorder; an affective disorder in which the victim tends to respond excessively and sometimes violently
manic	s	1:1	affected with or marked by frenzy or mania uncontrolled by reason
manky	s	1:1	inferior and worthless
manly	a	3:1	possessing qualities befitting a man
manly	s	3:2	characteristic of a man
