word	pos	ss:n	definition
aalii	n	1:1	a small Hawaiian tree with hard dark wood
abaca	n	2:1	a kind of hemp obtained from the abaca plant in the Philippines
abaca	n	2:2	Philippine banana tree having leafstalks that yield Manila hemp used for rope and paper etc
abaci	n	2:1	a tablet placed horizontally on top of the capital of a column as an aid in supporting the architrave
abaci	n	2:2	a calculator that performs arithmetic functions by manually sliding counters on rods or in grooves
aback	r	2:1	having the wind against the forward side of the sails
aback	r	2:2	by surprise
abaft	r	1:1	at or near or toward the stern of a ship or tail of an airplane
abamp	n	1:1	a unit of current equal to 10 amperes
abase	v	1:1	cause to feel shame; hurt the pride of
abash	v	1:1	cause to be embarrassed; cause to feel self-conscious
abate	v	2:1	make less active or intense
abate	v	2:2	become less in amount or intensity
abaya	n	1:1	(Arabic) a loose black robe from head to toe; traditionally worn by Muslim women
abbey	n	3:1	a church associated with a monastery or convent
abbey	n	3:2	a convent ruled by an abbess
abbey	n	3:3	a monastery ruled by an abbot
abbot	n	1:1	the superior of an abbey of monks
abeam	r	1:1	at right angles to the length of a ship or airplane
abele	n	1:1	a poplar that is widely cultivated in the United States; has white bark and leaves with whitish undersurfaces
abhor	v	1:1	find repugnant
abide	v	2:1	dwell
abide	v	2:2	put up with something or somebody unpleasant
abode	v	4:1	dwell
abode	v	4:2	put up with something or somebody unpleasant
abode	n	4:3	any address at which you dwell more than temporarily
abode	n	4:4	housing that someone is living in
abohm	n	1:1	a unit of resistance equal to a billionth of an ohm
abort	n	4:1	the act of terminating a project or procedure before it is completed
abort	v	4:2	terminate before completion
abort	v	4:3	cease development, die, and be aborted
abort	v	4:4	terminate a pregnancy by undergoing an abortion
about	s	8:1	on the move
about	r	8:2	(of quantities) imprecise but fairly close to correct
about	r	8:3	all around or on all sides
about	r	8:4	in the area or vicinity
about	r	8:5	used of movement to or among many different places or in no particular direction
about	r	8:6	in or to a reversed position or direction
about	r	8:7	in rotation or succession
about	r	8:8	(of actions or states) slightly short of or not quite accomplished; all but
above	s	4:1	appearing earlier in the same text
above	n	4:2	an earlier section of a written text
above	r	4:3	(in writing) at an earlier place
above	r	4:4	in or to a place that is higher
abuse	n	7:1	cruel or inhumane treatment
abuse	n	7:2	a rude expression intended to offend or hurt
abuse	n	7:3	improper or excessive use
abuse	v	7:4	treat badly
abuse	v	7:5	change the inherent purpose or function of something
abuse	v	7:6	use foul or abusive language towards
abuse	v	7:7	use wrongly or improperly or excessively
abuzz	s	1:1	noisy like the sound of a bee
abysm	n	1:1	a bottomless gulf or pit; any unfathomable (or apparently unfathomable) cavity or chasm or void extending below (often used figuratively)
abyss	n	1:1	a bottomless gulf or pit; any unfathomable (or apparently unfathomable) cavity or chasm or void extending below (often used figuratively)
acari	n	1:1	any of several mites of the order Acarina
acerb	s	2:1	sour or bitter in taste
acerb	s	2:2	harsh or corrosive in tone
acini	n	2:1	one of the small drupes making up an aggregate or multiple fruit like a blackberry
acini	n	2:2	one of the small sacs or saclike dilations in a compound gland
ackee	n	1:1	red pear-shaped tropical fruit with poisonous seeds; flesh is poisonous when unripe or overripe
acned	s	1:1	(of complexion) blemished by imperfections of the skin
acold	s	1:1	of persons; feeling cold
acorn	n	1:1	fruit of the oak tree: a smooth thin-walled nut in a woody cup-shaped base
acres	n	1:1	extensive landed property (especially in the country) retained by the owner for their own use
acrid	s	2:1	strong and sharp
acrid	s	2:2	harsh or corrosive in tone
actin	n	1:1	one of the proteins into which actomyosin can be split; can exist in either a globular or a fibrous form
actor	n	2:1	a theatrical performer
actor	n	2:2	a person who acts and gets things done
acute	a	7:1	having or experiencing a rapid onset and short but severe course
acute	s	7:2	extremely sharp or severe
acute	s	7:3	having or demonstrating ability to recognize or draw fine distinctions
acute	a	7:4	of an angle; less than 90 degrees
acute	s	7:5	ending in a sharp point
acute	s	7:6	of critical importance and consequence
acute	n	7:7	a mark placed above a vowel to indicate pronunciation
adage	n	1:1	a condensed but memorable saying embodying some important fact of experience that is taken as true by many people
adapt	v	2:1	make fit for, or change to suit a new purpose
adapt	v	2:2	adapt or conform oneself to new or different conditions
addax	n	1:1	large antelope with lightly spiraled horns of desert regions of northern Africa
adder	n	3:1	a person who adds numbers
adder	n	3:2	a machine that adds numbers
adder	n	3:3	small terrestrial viper common in northern Eurasia
addle	v	2:1	mix up or confuse
addle	v	2:2	become rotten
adept	s	2:1	having or showing knowledge and skill and aptitude
adept	n	2:2	someone who is dazzlingly skilled in any field
adieu	n	1:1	a farewell remark
adios	n	1:1	a farewell remark
adman	n	1:1	someone whose business is advertising
admit	v	8:1	declare to be true or admit the existence or reality or truth of
admit	v	8:2	allow to enter; grant entry to
admit	v	8:3	allow participation in or the right to be part of; permit to exercise the rights, functions, and responsibilities of
admit	v	8:4	admit into a group or community
admit	v	8:5	afford possibility
admit	v	8:6	give access or entrance to
admit	v	8:7	have room for; hold without crowding
admit	v	8:8	serve as a means of entrance
admix	v	1:1	mix or mingle
adobe	n	2:1	the clay from which adobe bricks are made
adobe	n	2:2	sun-dried brick; used in hot dry climates
adobo	n	1:1	a dish of marinated vegetables and meat or fish; served with rice
adopt	v	7:1	choose and follow; as of theories, ideas, policies, strategies or plans
adopt	v	7:2	take up and practice as one's own
adopt	v	7:3	take on titles, offices, duties, responsibilities
adopt	v	7:4	take on a certain form, attribute, or aspect
adopt	v	7:5	take into one's family
adopt	v	7:6	put into dramatic form
adopt	v	7:7	take up the cause, ideology, practice, method, of someone and use it as one's own
adore	v	1:1	love intensely
adorn	v	3:1	make more attractive by adding ornament, colour, etc.
adorn	v	3:2	be beautiful to look at
adorn	v	3:3	furnish with power or authority; of kings or emperors
adult	s	4:1	(of animals) fully developed
adult	s	4:2	designed to arouse lust
adult	n	4:3	a fully developed person from maturity onward
adult	n	4:4	any mature animal
adust	s	2:1	dried out by heat or excessive exposure to sunlight
adust	s	2:2	burned brown by the sun
aecia	n	1:1	fruiting body of some rust fungi bearing chains of aeciospores
aegir	n	1:1	a high wave (often dangerous) caused by tidal flow (as by colliding tidal currents or in a narrow estuary)
aegis	n	2:1	kindly endorsement and guidance
aegis	n	2:2	armor plate that protects the chest; the front part of a cuirass
aerie	n	2:1	the lofty nest of a bird of prey (such as a hawk or eagle)
aerie	n	2:2	any habitation at a high altitude
affix	n	4:1	a linguistic element added to a word to produce an inflected or derived form
affix	v	4:2	stick or fasten to
affix	v	4:3	add to the very end
affix	v	4:4	attach or become attached to a stem word
afire	s	1:1	lighted up by or as by fire or flame
afoot	s	3:1	traveling by foot
afoot	s	3:2	currently in progress
afoot	r	3:3	on foot; walking
afoul	s	1:1	especially of a ship's lines etc
after	s	3:1	located farther aft
after	r	3:2	happening at a time subsequent to a reference time
after	r	3:3	behind or in the rear
again	r	1:1	anew
agama	n	1:1	small terrestrial lizard of warm regions of the Old World
agape	s	4:1	with the mouth wide open as in wonder or awe
agape	n	4:2	(Christian theology) the love of God or Christ for mankind
agape	n	4:3	selfless love of one person for another without sexual implications (especially love that is spiritual in nature)
agape	n	4:4	a religious meal shared as a sign of love and fellowship
agate	n	1:1	an impure form of quartz consisting of banded chalcedony; used as a gemstone and for making mortars and pestles
agave	n	1:1	tropical American plants with basal rosettes of fibrous sword-shaped leaves and flowers in tall spikes; some cultivated for ornament or for fiber
agaze	s	1:1	(used of eyes) open and fixed as if in fear or wonder
agent	n	6:1	an active and efficient cause; capable of producing a certain effect
agent	n	6:2	a representative who acts on behalf of other persons or organizations
agent	n	6:3	a substance that exerts some force or effect
agent	n	6:4	a businessman who buys or sells for another in exchange for a commission
agent	n	6:5	any agent or representative of a federal agency or bureau
agent	n	6:6	the semantic role of the animate entity that instigates or causes the happening denoted by the verb in the clause
aggro	n	1:1	(informal British usage) aggravation or aggression
agile	s	2:1	moving quickly and lightly
agile	s	2:2	mentally quick
aging	s	3:1	growing old
aging	n	3:2	acquiring desirable qualities by being left undisturbed for some time
aging	n	3:3	the organic process of growing older and showing the effects of increasing age
agism	n	1:1	discrimination on the basis of a person's age
aglet	n	2:1	metal or plastic sheath over the end of a shoelace or ribbon
aglet	n	2:2	ornamental tagged cord or braid on the shoulder of a uniform
aglow	s	1:1	softly bright or radiant
agone	s	1:1	gone by; or in the past
agony	n	2:1	intense feelings of suffering; acute mental or physical pain
agony	n	2:2	a state of acute pain
agora	n	3:1	100 agorot equal 1 shekel in Israel
agora	n	3:2	the marketplace in ancient Greece
agora	n	3:3	a place of assembly for the people in ancient Greece
agree	v	7:1	be in accord; be in agreement
agree	v	7:2	consent or assent to a condition, or agree to do something
agree	v	7:3	be compatible, similar or consistent; coincide in their characteristics
agree	v	7:4	go together
agree	v	7:5	show grammatical agreement
agree	v	7:6	be agreeable or suitable
agree	v	7:7	achieve harmony of opinion, feeling, or purpose
ahead	s	8:1	having the leading position or higher score in a contest
ahead	r	8:2	at or in the front
ahead	r	8:3	toward the future; forward in time
ahead	r	8:4	in a forward direction
ahead	r	8:5	ahead of time; in anticipation
ahead	r	8:6	to a more advanced or advantageous position
ahead	r	8:7	to a different or a more advanced time (meaning advanced either toward the present or toward the future)
ahead	r	8:8	leading or ahead in a competition
aided	a	1:1	having help; often used as a combining form
aioli	n	1:1	garlic mayonnaise
aired	s	1:1	open to or abounding in fresh air
aisle	n	3:1	a long narrow passage (as in a cave or woods)
aisle	n	3:2	passageway between seating areas as in an auditorium or passenger vehicle or between areas of shelves of goods as in stores
aisle	n	3:3	part of a church divided laterally from the nave proper by rows of pillars or columns
alarm	n	6:1	fear resulting from the awareness of danger
alarm	n	6:2	a device that signals the occurrence of some undesirable event
alarm	n	6:3	an automatic signal (usually a sound) warning of danger
alarm	n	6:4	a clock that wakes a sleeper at some preset time
alarm	v	6:5	fill with apprehension or alarm; cause to be unpleasantly surprised
alarm	v	6:6	warn or arouse to a sense of danger or call to a state of preparedness
alary	s	1:1	having or resembling wings
alate	s	1:1	(of seeds or insects) having winglike extensions
album	n	2:1	one or more recordings issued together; originally released on 12-inch phonograph records (usually with attractive record covers) and later on cassette audiotape and compact disc
album	n	2:2	a book of blank pages with pockets or envelopes; for organizing photographs or stamp collections etc
alder	n	2:1	wood of any of various alder trees; resistant to underwater rot; used for bridges etc
alder	n	2:2	north temperate shrubs or trees having toothed leaves and conelike fruit; bark is used in tanning and dyeing and the wood is rot-resistant
aldol	n	1:1	an oily colorless liquid obtained by the condensation of two molecules of acetaldehyde; contains an alcohol group (-OH) and an aldehyde group (-CHO)
aleph	n	1:1	the 1st letter of the Hebrew alphabet
alert	a	7:1	engaged in or accustomed to close observation
alert	s	7:2	quick and energetic
alert	s	7:3	mentally perceptive and responsive
alert	n	7:4	condition of heightened watchfulness or preparation for action
alert	n	7:5	a warning serves to make you more alert to danger
alert	n	7:6	an automatic signal (usually a sound) warning of danger
alert	v	7:7	warn or arouse to a sense of danger or call to a state of preparedness
algae	n	1:1	primitive chlorophyll-containing mainly aquatic eukaryotic organisms lacking true stems and roots and leaves
algal	a	1:1	of or relating to alga
algid	s	1:1	chilly
algin	n	1:1	a gum used especially as a thickener or emulsifier
alias	n	2:1	a name that has been assumed
alias	r	2:2	as known or named at another time or place
alibi	n	3:1	(law) a defense by an accused person purporting to show that they could not have committed the crime in question
alibi	n	3:2	a defense of some offensive behavior or some failure to keep a promise etc.
alibi	v	3:3	exonerate by means of an alibi
alien	s	6:1	not contained in or deriving from the essential nature of something
alien	s	6:2	being or from or characteristic of another place or part of the world
alien	n	6:3	a person who comes from a foreign country; someone who does not owe allegiance to your country
alien	n	6:4	anyone who does not belong in the environment in which they are found
alien	n	6:5	a form of life assumed to exist outside the Earth or its atmosphere
alien	v	6:6	transfer property or ownership
align	v	4:1	place in a line or arrange so as to be parallel or straight
align	v	4:2	be or come into adjustment with
align	v	4:3	align oneself with a group or a way of thinking
align	v	4:4	bring (components or parts) into proper or desirable coordination correlation
alike	a	3:1	having the same or similar characteristics
alike	r	3:2	equally
alike	r	3:3	in a like manner
aline	v	1:1	place in a line or arrange so as to be parallel or straight
alive	a	7:1	possessing life
alive	s	7:2	(often followed by ‘with’) full of life and spirit
alive	a	7:3	having life or vigor or spirit
alive	s	7:4	(followed by ‘to’ or ‘of’) aware of
alive	s	7:5	in operation
alive	s	7:6	mentally perceptive and responsive
alive	s	7:7	capable of erupting
alkyd	n	1:1	a durable synthetic resin widely used in adhesives and paints
alkyl	n	1:1	any of a series of univalent groups of the general formula CnH2n+1 derived from aliphatic hydrocarbons
allay	v	2:1	lessen the intensity of or calm
allay	v	2:2	satisfy (thirst)
alley	n	2:1	a narrow street with walls on both sides
alley	n	2:2	a lane down which a bowling ball is rolled toward pins
allis	n	1:1	European shad
allot	v	3:1	give out
allot	v	3:2	allow to have
allot	v	3:3	administer or bestow, as in small portions
allow	v	10:1	make it possible through a specific action or lack of action for something to happen
allow	v	10:2	consent to, give permission; permit
allow	v	10:3	let have
allow	v	10:4	give or assign a resource to a particular person or cause
allow	v	10:5	make a possibility or provide opportunity for; permit to be attainable or cause to remain
allow	v	10:6	allow or plan for a certain possibility; concede the truth or validity of something
allow	v	10:7	afford possibility
allow	v	10:8	allow the other (baseball) team to score
allow	v	10:9	grant as a discount or in exchange
allow	v	10:10	allow the presence of or allow (an activity) without opposing or prohibiting
alloy	n	4:1	a mixture containing two or more metallic elements or metallic and nonmetallic elements usually fused together or dissolving into each other when molten
alloy	n	4:2	the state of impairing the quality or reducing the value of something
alloy	v	4:3	lower in value by increasing the base-metal content
alloy	v	4:4	make an alloy of
allyl	n	1:1	the univalent unsaturated organic radical C3H5; derived from propylene
aloes	n	1:1	a purgative made from the leaves of aloe
aloft	r	4:1	at or on or to the masthead or upper rigging of a ship
aloft	r	4:2	upward
aloft	r	4:3	at or to great height; high up in or into the air
aloft	r	4:4	in the higher atmosphere above the earth
aloha	n	1:1	an acknowledgment that can be used to say hello or goodbye (aloha is Hawaiian and ciao is Italian)
alone	s	6:1	isolated from others
alone	s	6:2	lacking companions or companionship
alone	s	6:3	exclusive of anyone or anything else
alone	s	6:4	radically distinctive and without equal
alone	r	6:5	without any others being included or involved
alone	r	6:6	without anybody else or anything else
along	r	5:1	with a forward motion
along	r	5:2	in accompaniment or as a companion
along	r	5:3	to a more advanced state
along	r	5:4	in addition (usually followed by ‘with’)
along	r	5:5	in line with a length or direction (often followed by ‘by’ or ‘beside’)
aloof	s	2:1	remote in manner
aloof	r	2:2	in an aloof manner
aloud	r	2:1	using the voice; not silently
aloud	r	2:2	with relatively high volume
alpha	s	4:1	first in order of importance
alpha	s	4:2	early testing stage of a software or hardware product
alpha	n	4:3	the 1st letter of the Greek alphabet
alpha	n	4:4	the beginning of a series or sequence
altar	n	2:1	the table in Christian churches where communion is given
altar	n	2:2	a raised structure on which gifts or sacrifices to a god are made
alter	v	5:1	cause to change; make different; cause a transformation
alter	v	5:2	become different in some particular way, without permanently losing one's or its former characteristics or essence
alter	v	5:3	make an alteration to
alter	v	5:4	insert words into texts, often falsifying it thereby
alter	v	5:5	remove the ovaries of
alula	n	2:1	scalelike structure between the base of the wing and the halter of a two-winged fly
alula	n	2:2	tuft of small stiff feathers on the first digit of a bird's wing
amain	r	2:1	at full speed; with great haste
amain	r	2:2	with all your strength
amass	v	2:1	increase in amount by collecting or gathering
amass	v	2:2	get or gather together
amaze	v	2:1	affect with wonder
amaze	v	2:2	be a mystery or bewildering to
amber	s	3:1	of a medium to dark brownish yellow color
amber	n	3:2	a deep yellow color
amber	n	3:3	a hard yellowish to brownish translucent fossil resin; used for jewelry
ambit	n	1:1	an area in which something acts or operates or has power or control:
amble	n	2:1	a leisurely walk (usually in some public place)
amble	v	2:2	walk leisurely
ameba	n	1:1	naked freshwater or marine or parasitic protozoa that form temporary pseudopods for feeding and locomotion
ameer	n	1:1	an independent ruler or chieftain (especially in Africa or Arabia)
amend	v	3:1	make amendments to
amend	v	3:2	to make better
amend	v	3:3	set straight or right
ament	n	1:1	a cylindrical spikelike inflorescence
amide	n	1:1	any organic compound containing the group -CONH2
amigo	n	1:1	a friend or comrade
amine	n	1:1	a compound derived from ammonia by replacing hydrogen atoms by univalent hydrocarbon radicals
amino	a	2:1	pertaining to or containing any of a group of organic compounds of nitrogen derived from ammonia
amino	n	2:2	the radical -NH2
amiss	s	4:1	not functioning properly
amiss	r	4:2	away from the correct or expected course
amiss	r	4:3	in an improper or mistaken or unfortunate manner
amiss	r	4:4	in an imperfect or faulty way
amity	n	2:1	a cordial disposition
amity	n	2:2	a state of friendship and cordiality
amnia	n	1:1	thin innermost membranous sac enclosing the developing embryo of higher vertebrates (reptiles, birds and mammals)
amnic	a	1:1	of or related to the amnion or characterized by developing an amnion
amnio	n	1:1	(pregnancy) extraction by centesis of amniotic fluid from a pregnant woman (after the 15th week of pregnancy) to aid in the diagnosis of fetal abnormalities
amora	n	1:1	one of a group of rabbis (active AD 250-500) who discussed the Mishnaic law in the law schools of Palestine and Mesopotamia where they explained and applied earlier teachings and whose discussions are recorded in the Talmud; they emphasized the study of Torah and the importance of personal action and the fulfillment of the commandments
amort	s	1:1	utterly cast down
amour	n	1:1	a usually secretive or illicit sexual relationship
ample	a	3:1	more than enough in size or scope or capacity
ample	s	3:2	affording an abundant supply
ample	s	3:3	fairly large in size
amply	r	2:1	to an ample degree or in an ample manner
amply	r	2:2	sufficiently; more than adequately
ampul	n	1:1	a small bottle that contains a drug (especially a sealed sterile container for injection by needle)
amuck	s	3:1	wildly frenzied and out of control
amuck	r	3:2	wildly; without self-control
amuck	r	3:3	in a murderous frenzy
amuse	v	2:1	occupy in an agreeable, entertaining or pleasant fashion
amuse	v	2:2	make (somebody) laugh
anele	v	1:1	administer an oil or ointment to; often in a religious ceremony of blessing
angel	n	4:1	the highest waterfall; has more than one leap; flow varies seasonally
angel	n	4:2	spiritual being attendant upon God
angel	n	4:3	a person of exceptional holiness
angel	n	4:4	someone who provides financial support for some venture
anger	n	5:1	a strong emotion; a feeling that is oriented toward some real or supposed grievance
anger	n	5:2	the state of being angry
anger	n	5:3	belligerence aroused by a real or supposed wrong (personified as one of the deadly sins)
anger	v	5:4	make angry
anger	v	5:5	become angry
angle	n	8:1	a member of a Germanic people who conquered England and merged with the Saxons and Jutes to become Anglo-Saxons
angle	n	8:2	the space between two lines or planes that intersect; the inclination of one line to another; measured in degrees or radians
angle	n	8:3	a biased way of looking at or presenting something
angle	v	8:4	move or proceed at an angle
angle	v	8:5	to incline or bend from a vertical position
angle	v	8:6	seek indirectly
angle	v	8:7	fish with a hook
angle	v	8:8	present with a bias
angry	a	3:1	feeling or showing anger
angry	s	3:2	(of the elements) as if showing violent anger
angry	s	3:3	severely inflamed and painful
angst	n	1:1	an acute but unspecific feeling of anxiety; usually reserved for philosophical anxiety about the world or about personal freedom
anile	s	1:1	of or like a feeble old woman
anima	n	1:1	(Jungian psychology) the inner self (not the external persona) that is in touch with the unconscious
anime	n	3:1	a hard copal derived from an African tree
anime	n	3:2	any of various resins or oleoresins
anime	n	3:3	a style of animation developed in Japan, characterized by stylized colorful art and often adult themes
anion	n	1:1	a negatively charged ion
anise	n	2:1	native to Egypt but cultivated widely for its aromatic seeds and the oil from them used medicinally and as a flavoring in cookery
anise	n	2:2	liquorice-flavored seeds, used medicinally and in cooking and liquors
anjou	n	2:1	a former province of western France in the Loire valley
anjou	n	2:2	a pear with firm flesh and a green skin
ankle	n	1:1	a gliding joint between the distal ends of the tibia and fibula and the proximal end of the talus
ankus	n	1:1	an elephant goad with a sharp spike and a hook
annex	n	3:1	an addition that extends a main building
annex	v	3:2	take (territory) as if by conquest
annex	v	3:3	add an extra part to
annon	n	1:1	sweet pulpy tropical fruit with thick scaly rind and shiny black seeds
annoy	v	1:1	cause annoyance in; disturb, especially by minor irritations
annul	v	2:1	declare invalid
annul	v	2:2	cancel officially
annum	n	1:1	(Latin) year
anode	n	2:1	a positively charged electrode by which electrons leave an electrical device
anode	n	2:2	the negatively charged terminal of a voltaic cell or storage battery that supplies current
anole	n	1:1	small arboreal tropical American insectivorous lizards with the ability to change skin color
anomy	n	2:1	personal state of isolation and anxiety resulting from a lack of social control and regulation
anomy	n	2:2	lack of moral standards in a society
antic	s	3:1	ludicrously odd
antic	n	3:2	a ludicrous or grotesque act done for fun and amusement
antic	v	3:3	act as or like a clown
antra	n	1:1	a natural cavity or hollow in a bone
antsy	s	1:1	nervous and unable to relax
anvil	n	2:1	a heavy block of iron or steel on which hot metals are shaped by hammering
anvil	n	2:2	a small bone in the middle ear between the malleus and the stapes
aorta	n	1:1	the large trunk artery that carries blood from the left ventricle of the heart to branch arteries
apace	r	2:1	(poetic, literary) quickly
apace	r	2:2	with speed
apart	s	8:1	remote and separate physically or socially
apart	s	8:2	having characteristics not shared by others
apart	r	8:3	separated or at a distance in place or position or time
apart	r	8:4	not taken into account or excluded from consideration
apart	r	8:5	away from another or others
apart	r	8:6	placed or kept separate and distinct as for a purpose
apart	r	8:7	one from the other
apart	r	8:8	into parts or pieces
apery	n	1:1	the act of mimicking; imitative behavior
aphid	n	1:1	any of various small plant-sucking insects
apian	a	1:1	relating to or having the characteristics of bees
apish	s	1:1	being or given to servile imitation
apnea	n	1:1	transient cessation of respiration
appal	v	2:1	strike with disgust or revulsion
appal	v	2:2	fill with apprehension or alarm; cause to be unpleasantly surprised
apple	n	2:1	fruit with red or yellow or green skin and sweet to tart crisp whitish flesh
apple	n	2:2	native Eurasian tree widely cultivated in many varieties for its firm rounded edible fruits
