word	pos	ss:n	definition
dinar	n	9:8	the basic unit of money in Bahrain; equal to 1,000 fils
dinar	n	9:9	the basic unit of money in Algeria
diner	n	3:1	a person eating a meal (especially in a restaurant)
diner	n	3:2	a passenger car where food is served in transit
diner	n	3:3	a restaurant that resembles a dining car
dinge	n	3:1	discoloration due to dirtiness
dinge	v	3:2	make a dent or impression in
dinge	v	3:3	make dingy
dingo	n	1:1	wolflike yellowish-brown wild dog of Australia
dingy	s	3:1	thickly covered with ingrained dirt or soot
dingy	s	3:2	(of color) discolored by impurities; not bright and clear; ‘dirty’ is often used in combination
dingy	s	3:3	causing dejection
dinky	s	3:1	small and unimpressive
dinky	s	3:2	(British informal) pretty and neat
dinky	n	3:3	a small locomotive
diode	n	2:1	a thermionic tube having two electrodes; used as a rectifier
diode	n	2:2	a semiconductor that consists of a p-n junction
dioon	n	1:1	any cycad of the genus Dioon; handsome palmlike cycads with robust crowns of leaves and rugged trunks
dirge	n	1:1	a song or hymn of mourning composed or performed as a memorial to a dead person
dirty	a	13:1	soiled or likely to soil with dirt or grime
dirty	a	13:2	(of behavior or especially language) characterized by obscenity or indecency
dirty	s	13:3	vile; despicable
dirty	a	13:4	spreading pollution or contamination; especially radioactive contamination
dirty	s	13:5	contaminated with infecting organisms
dirty	s	13:6	(of color) discolored by impurities; not bright and clear; ‘dirty’ is often used in combination
dirty	s	13:7	(of a manuscript) defaced with changes
dirty	s	13:8	obtained illegally or by improper means
dirty	s	13:9	expressing or revealing hostility or dislike
dirty	s	13:10	violating accepted standards or rules
dirty	s	13:11	unethical or dishonest
dirty	s	13:12	unpleasantly stormy
dirty	v	13:13	make soiled, filthy, or dirty
disci	n	2:1	an athletic competition in which a disk-shaped object is thrown as far as possible
disci	n	2:2	a disk used in throwing competitions
disco	n	3:1	popular dance music (especially in the late 1970s); melodic with a regular bass beat; intended mainly for dancing at discotheques
disco	n	3:2	a public dance hall for dancing to recorded popular music
disco	v	3:3	dance to disco music
dishy	s	1:1	(informal British) sexually attractive
ditch	n	8:1	a long narrow excavation in the earth
ditch	n	8:2	any small natural waterway
ditch	v	8:3	forsake
ditch	v	8:4	throw away
ditch	v	8:5	sever all ties with, usually unceremoniously or irresponsibly
ditch	v	8:6	make an emergency landing on water
ditch	v	8:7	crash or crash-land
ditch	v	8:8	cut a trench in, as for drainage
ditto	n	2:1	a mark used to indicate the word above it should be repeated
ditto	v	2:2	repeat an action or statement
ditty	n	1:1	a short simple song (or the words of a poem intended to be sung)
divan	n	4:1	a long backless sofa (usually with pillows against a wall)
divan	n	4:2	a Muslim council of state
divan	n	4:3	a collection of Persian or Arabic poems (usually by one author)
divan	n	4:4	a Muslim council chamber or law court
diver	n	3:1	someone who works underwater
diver	n	3:2	someone who dives (into water)
diver	n	3:3	large somewhat primitive fish-eating diving bird of the Northern Hemisphere having webbed feet placed far back; related to the grebes
divot	n	2:1	(golf) the cavity left when a piece of turf is cut from the ground by the club head in making a stroke
divot	n	2:2	a piece of turf dug out of a lawn or fairway (by an animals hooves or a golf club)
divvy	n	1:1	short for dividend; especially one paid by a cooperative society
diwan	n	3:1	a Muslim council of state
diwan	n	3:2	a collection of Persian or Arabic poems (usually by one author)
diwan	n	3:3	a Muslim council chamber or law court
dixie	n	2:1	the southern states that seceded from the United States in 1861
dixie	n	2:2	a large metal pot (12 gallon camp kettle) for cooking; used in military camps
dizen	v	1:1	dress up garishly and tastelessly
dizzy	s	3:1	having or causing a whirling sensation; liable to falling
dizzy	s	3:2	lacking seriousness; given to frivolity
dizzy	v	3:3	make dizzy or giddy
djinn	n	1:1	(Islam) an invisible spirit mentioned in the Koran and believed by Muslims to inhabit the earth and influence mankind by appearing in the form of humans or animals
dobra	n	1:1	the basic unit of money on Sao Tome e Principe
dodge	n	6:1	an elaborate or deceitful scheme contrived to deceive or evade
dodge	n	6:2	a quick evasive movement
dodge	n	6:3	a statement that evades the question by cleverness or trickery
dodge	v	6:4	make a sudden movement in a new direction so as to avoid
dodge	v	6:5	move to and fro or from place to place usually in an irregular course
dodge	v	6:6	avoid or try to avoid fulfilling, answering, or performing (duties, questions, or issues)
dodgy	s	2:1	of uncertain outcome; especially fraught with risk
dodgy	s	2:2	marked by skill in deception
doggo	r	1:1	quietly in concealment
doggy	n	1:1	informal terms for dogs
dogie	n	1:1	motherless calf in a range herd of cattle
dogma	n	2:1	a religious doctrine that is proclaimed as true without proof
dogma	n	2:2	a doctrine or code of beliefs accepted as authoritative
doily	n	1:1	a small round piece of linen placed under a dish or bowl
dolce	r	1:1	gently and sweetly
dolly	n	3:1	conveyance consisting of a wheeled support on which a camera can be mounted
dolly	n	3:2	conveyance consisting of a wheeled platform for moving heavy objects
dolly	n	3:3	a small replica of a person; used as a toy
dolor	n	1:1	(poetry) painful grief
domed	s	1:1	having a hemispherical vault or dome
donee	n	1:1	the recipient of funds or other benefits
donna	n	1:1	an Italian woman of rank
donor	n	2:1	person who makes a gift of property
donor	n	2:2	(medicine) someone who gives blood or tissue or an organ to be used in another person (the host)
donut	n	1:1	a small ring-shaped friedcake
doped	s	2:1	treated or impregnated with a foreign substance
doped	s	2:2	under the influence of narcotics
dopey	s	1:1	having or revealing stupidity
doric	n	2:1	the dialect of Ancient Greek spoken in Doris
doric	a	2:2	of or pertaining to the Doric style of architecture
dormy	s	1:1	in match play a side that stands as many holes ahead as there are holes remaining to be played
dorsa	n	2:1	the posterior part of a human (or animal) body from the neck to the end of the spine
dorsa	n	2:2	the back of the body of a vertebrate or any analogous surface (as the upper or outer surface of an organ or appendage or part)
dosed	s	1:1	treated with some kind of application
dotty	s	2:1	informal or slang terms for mentally irregular
dotty	s	2:2	intensely enthusiastic about or preoccupied with
doubt	n	4:1	the state of being unsure of something
doubt	n	4:2	uncertainty about the truth or factuality or existence of something
doubt	v	4:3	consider unlikely
doubt	v	4:4	lack confidence in
dough	n	2:1	a flour mixture stiff enough to knead or roll
dough	n	2:2	informal terms for money
doula	n	1:1	an assistant (often the father of the soon-to-be-born child) who provides support for a woman in labor by encouraging her to use techniques learned in childbirth-preparation classes
doura	n	1:1	sorghums of dry regions of Asia and North Africa
douse	v	7:1	put out, as of a candle or a light
douse	v	7:2	wet thoroughly
douse	v	7:3	dip into a liquid
douse	v	7:4	immerse briefly into a liquid so as to wet, coat, or saturate
douse	v	7:5	lower quickly
douse	v	7:6	slacken
douse	v	7:7	cover with liquid; pour liquid onto
dowdy	n	4:1	British marshal of the RAF who commanded the British air defense forces that defeated the Luftwaffe during the Battle of Britain (1882-1970)
dowdy	s	4:2	lacking in smartness or taste
dowdy	s	4:3	primly out of date
dowdy	n	4:4	deep-dish apple dessert covered with a rich crust
dowel	n	1:1	a fastener that is inserted into holes in two adjacent pieces and holds them together
dower	n	3:1	money or property brought by a woman to her husband at marriage
dower	n	3:2	a life estate to which a wife is entitled on the death of her husband
dower	v	3:3	furnish with an endowment
downy	s	2:1	like down or as soft as down
downy	s	2:2	covered with fine soft hairs or down
dowry	n	1:1	money or property brought by a woman to her husband at marriage
dowse	n	5:1	searching for underground water or minerals by using a dowsing rod
dowse	v	5:2	wet thoroughly
dowse	v	5:3	use a divining rod in search of underground water or metal
dowse	v	5:4	slacken
dowse	v	5:5	cover with liquid; pour liquid onto
doyen	n	1:1	a man who is the senior member of a group
doyly	n	1:1	a small round piece of linen placed under a dish or bowl
dozen	s	2:1	being one more than eleven
dozen	n	2:2	the cardinal number that is the sum of eleven and one
dozer	n	1:1	large powerful tractor; a large blade in front flattens areas of ground
draba	n	1:1	any of numerous low-growing cushion-forming plants of the genus Draba having rosette-forming leaves and terminal racemes of small flowers with scapose or leafy stems; fruit is a dehiscent oblong or linear silique
draff	n	1:1	the residue of malt and grain which remains in the mash-kettle after the mashing and lautering process.
draft	n	14:1	a document ordering the payment of money; drawn by one person or bank on another
draft	n	14:2	a current of air (usually coming into a chimney or room or vehicle)
draft	n	14:3	a preliminary sketch of a design or picture
draft	n	14:4	a serving of drink (usually alcoholic) drawn from a keg
draft	n	14:5	any of the various versions in the development of a written work
draft	n	14:6	the depth of a vessel's keel below the surface (especially when loaded)
draft	n	14:7	a regulator for controlling the flow of air in a fireplace
draft	n	14:8	a dose of liquid medicine
draft	n	14:9	compulsory military service
draft	n	14:10	a large and hurried swallow
draft	n	14:11	the act of moving a load by drawing or pulling
draft	v	14:12	draw up an outline or sketch for something
draft	v	14:13	engage somebody to enter the army
draft	v	14:14	make a blueprint of
drain	n	8:1	emptying something accomplished by allowing liquid to run out of it
drain	n	8:2	tube inserted into a body cavity (as during surgery) to remove unwanted material
drain	n	8:3	a pipe through which liquid is carried away
drain	n	8:4	a gradual depletion of energy or resources
drain	v	8:5	flow off gradually
drain	v	8:6	deplete of resources
drain	v	8:7	empty of liquid; drain the liquid from
drain	v	8:8	make weak
drake	n	2:1	English explorer and admiral who was the first Englishman to circumnavigate the globe and who helped to defeat the Spanish Armada (1540-1596)
drake	n	2:2	adult male of a wild or domestic duck
drama	n	4:1	a dramatic work intended for performance by actors on a stage
drama	n	4:2	an episode that is turbulent or highly emotional
drama	n	4:3	the literary genre of works intended for the theater
drama	n	4:4	the quality of being arresting or highly emotional
drank	v	5:1	take in liquids
drank	v	5:2	consume alcohol
drank	v	5:3	propose a toast to
drank	v	5:4	be fascinated or spell-bound by; pay close attention to
drank	v	5:5	drink excessive amounts of alcohol; be an alcoholic
drape	n	7:1	hanging cloth used as a blind (especially for a window)
drape	n	7:2	the manner in which fabric hangs or falls
drape	n	7:3	a sterile covering arranged over a patient's body during a medical examination or during surgery in order to reduce the possibility of contamination
drape	v	7:4	arrange in a particular way
drape	v	7:5	place casually
drape	v	7:6	cover as if with clothing
drape	v	7:7	cover or dress loosely with cloth
drawl	n	2:1	a slow speech pattern with prolonged vowels
drawl	v	2:2	lengthen and slow down or draw out
drawn	v	38:1	cause to move by pulling
drawn	v	38:2	get or derive
drawn	v	38:3	make a mark or lines on a surface
drawn	v	38:4	make, formulate, or derive in the mind
drawn	v	38:5	bring, take, or pull out of a container or from under a cover
drawn	v	38:6	represent by making a drawing of, as with a pencil, chalk, etc. on a surface
drawn	v	38:7	take liquid out of a container or well
drawn	v	38:8	give a description of
drawn	v	38:9	select or take in from a given group or region
drawn	v	38:10	elicit responses, such as objections, criticism, applause, etc.
drawn	v	38:11	suck in or take (air)
drawn	v	38:12	move or go steadily or gradually
drawn	v	38:13	remove (a commodity) from (a supply source)
drawn	v	38:14	choose at random
drawn	v	38:15	earn or achieve a base by being walked by the pitcher
drawn	v	38:16	bring or lead someone to a certain action or condition
drawn	v	38:17	to obtain a liquid from somewhere
drawn	v	38:18	write a legal document or paper
drawn	v	38:19	engage in drawing
drawn	v	38:20	move or pull so as to cover or uncover something
drawn	v	38:21	allow a draft
drawn	v	38:22	require a specified depth for floating
drawn	v	38:23	pull (a person) apart with four horses tied to their extremities, so as to execute them
drawn	v	38:24	cause to move in a certain direction by exerting a force upon, either physically or in an abstract sense
drawn	v	38:25	take in, also metaphorically
drawn	v	38:26	direct toward itself or oneself by means of some psychological power or physical attributes
drawn	v	38:27	thread on or as if on a string
drawn	v	38:28	stretch back a bowstring (on an archer's bow)
drawn	v	38:29	pass over, across, or through
drawn	v	38:30	finish a game with an equal number of points, goals, etc.
drawn	v	38:31	shrink
drawn	v	38:32	reduce the diameter of (a wire or metal rod) by pulling it through a die
drawn	v	38:33	steep; pass through a strainer
drawn	v	38:34	remove the entrails of
drawn	v	38:35	flatten, stretch, or mold metal or glass, by rolling or by pulling it through a die or by stretching
drawn	v	38:36	cause to localize at one point
drawn	s	38:37	showing the wearing effects of overwork or care or suffering
drawn	s	38:38	having the curtains or draperies closed or pulled shut
dread	s	3:1	causing fear or dread or terror
dread	n	3:2	fearful expectation or anticipation
dread	v	3:3	be afraid or scared of; be frightened of
dream	n	8:1	a series of mental images and emotions occurring during sleep
dream	n	8:2	imaginative thoughts indulged in while awake
dream	n	8:3	a cherished desire
dream	n	8:4	a fantastic but vain hope (from fantasies induced by the opium pipe)
dream	n	8:5	a state of mind characterized by abstraction and release from reality
dream	n	8:6	someone or something wonderful
dream	v	8:7	have a daydream; indulge in a fantasy
dream	v	8:8	experience while sleeping
drear	s	1:1	causing dejection
dreck	n	1:1	merchandise that is shoddy or inferior
dregs	n	1:1	sediment that has settled at the bottom of a liquid
dress	s	21:1	suitable for formal occasions
dress	s	21:2	(of an occasion) requiring formal clothes
dress	n	21:3	a one-piece garment for a woman; has skirt and bodice
dress	n	21:4	clothing of a distinctive style or for a particular occasion
dress	n	21:5	clothing in general
dress	v	21:6	put on clothes
dress	v	21:7	provide with clothes or put clothes on
dress	v	21:8	put a finish on
dress	v	21:9	dress in a certain manner
dress	v	21:10	dress or groom with elaborate care
dress	v	21:11	kill and prepare for market or consumption
dress	v	21:12	arrange in ranks
dress	v	21:13	decorate (food), as with parsley or other ornamental foods
dress	v	21:14	provide with decoration
dress	v	21:15	put a dressing on
dress	v	21:16	cultivate, tend, and cut back the growth of
dress	v	21:17	cut down rough-hewn (lumber) to standard thickness and width
dress	v	21:18	convert into leather
dress	v	21:19	apply a bandage or medication to
dress	v	21:20	give a neat appearance to
dress	v	21:21	arrange attractively
dried	s	4:1	not still wet
dried	s	4:2	preserved by removing natural moisture
dried	v	4:3	remove the moisture from and make dry
dried	v	4:4	become dry or drier
drier	n	18:1	a substance that promotes drying (e.g., calcium oxide absorbs water and is used to remove moisture)
drier	n	18:2	an appliance that removes moisture
drier	a	18:3	free from liquid or moisture; lacking natural or normal moisture or depleted of water; or no longer wet
drier	s	18:4	humorously sarcastic or mocking
drier	a	18:5	lacking moisture or volatile components
drier	a	18:6	opposed to or prohibiting the production and sale of alcoholic beverages
drier	a	18:7	not producing milk
drier	a	18:8	(of liquor) having a low residual sugar content because of decomposition of sugar during fermentation
drier	a	18:9	without a mucous or watery discharge
drier	s	18:10	not shedding tears
drier	s	18:11	lacking interest or stimulation; dull and lifeless
drier	s	18:12	used of solid substances in contrast with liquid ones
drier	s	18:13	unproductive especially of the expected results
drier	s	18:14	having no adornment or coloration
drier	s	18:15	(of food) eaten without a spread or sauce or other garnish
drier	s	18:16	having a large proportion of strong liquor
drier	s	18:17	lacking warmth or emotional involvement
drier	s	18:18	practicing complete abstinence from alcoholic beverages
drift	n	17:1	a force that moves something along
drift	n	17:2	the gradual departure from an intended course due to external influences (as a ship or plane)
drift	n	17:3	a process of linguistic change over a period of time
drift	n	17:4	a large mass of material that is heaped up by the wind or by water currents
drift	n	17:5	a general tendency to change (as of opinion)
drift	n	17:6	the pervading meaning or tenor
drift	n	17:7	a horizontal (or nearly horizontal) passageway in a mine
drift	v	17:8	be in motion due to some air or water current
drift	v	17:9	wander from a direct course or at random
drift	v	17:10	move about aimlessly or without any destination, often in search of food or employment
drift	v	17:11	vary or move from a fixed point or course
drift	v	17:12	live unhurriedly, irresponsibly, or freely
drift	v	17:13	move in an unhurried fashion
drift	v	17:14	cause to be carried by a current
drift	v	17:15	drive slowly and far afield for grazing
drift	v	17:16	be subject to fluctuation
drift	v	17:17	be piled up in banks or heaps by the force of wind or a current
drill	n	9:1	a tool with a sharp point and cutting edges for making holes in hard materials (usually rotating rapidly or by repeated blows)
drill	n	9:2	similar to the mandrill but smaller and less brightly colored
drill	n	9:3	systematic training by multiple repetitions
drill	n	9:4	(military) the training of soldiers to march (as in ceremonial parades) or to perform the manual of arms
drill	v	9:5	make a hole, especially with a pointed power or hand tool
drill	v	9:6	train in the military, e.g., in the use of weapons
drill	v	9:7	learn by repetition
drill	v	9:8	teach by repetition
drill	v	9:9	undergo military training or do military exercises
drily	r	1:1	in a dry laconic manner
drink	n	10:1	a single serving of a beverage
drink	n	10:2	the act of drinking alcoholic beverages to excess
drink	n	10:3	any liquid suitable for drinking
drink	n	10:4	any large deep body of water
drink	n	10:5	the act of swallowing
drink	v	10:6	take in liquids
drink	v	10:7	consume alcohol
drink	v	10:8	propose a toast to
drink	v	10:9	be fascinated or spell-bound by; pay close attention to
drink	v	10:10	drink excessive amounts of alcohol; be an alcoholic
drive	n	34:1	the act of applying force to propel something
drive	n	34:2	a mechanism by which force or power is transmitted in a machine
drive	n	34:3	a series of actions advancing a principle or tending toward a particular end
drive	n	34:4	a road leading up to a private house
drive	n	34:5	the trait of being highly motivated
drive	n	34:6	hitting a golf ball off of a tee with a driver
drive	n	34:7	the act of driving a herd of animals overland
drive	n	34:8	a journey in a vehicle (usually an automobile)
drive	n	34:9	a physiological state corresponding to a strong need or desire
drive	n	34:10	(computer science) a device that writes data onto or reads data from a storage medium
drive	n	34:11	a wide scenic road planted with trees
drive	n	34:12	(sports) a hard straight return (as in tennis or squash)
drive	v	34:13	operate or control a vehicle
drive	v	34:14	travel or be transported in a vehicle
drive	v	34:15	cause someone or something to move by driving
drive	v	34:16	force into or from an action or state, either physically or metaphorically
drive	v	34:17	to compel or force or urge relentlessly or exert coercive pressure on, or motivate strongly
drive	v	34:18	cause to move back by force or influence
drive	v	34:19	compel somebody to do something, often against their own will or judgment
drive	v	34:20	push, propel, or press with force
drive	v	34:21	cause to move rapidly by striking or throwing with force
drive	v	34:22	strive and make an effort to reach a goal
drive	v	34:23	move into a desired direction of discourse
drive	v	34:24	have certain properties when driven
drive	v	34:25	work as a driver
drive	v	34:26	move by being propelled by a force
drive	v	34:27	urge forward
drive	v	34:28	proceed along in a vehicle
drive	v	34:29	strike with a driver, as in teeing off
drive	v	34:30	hit very hard, as by swinging a bat horizontally
drive	v	34:31	excavate horizontally
drive	v	34:32	cause to function by supplying the force or power for or by controlling
drive	v	34:33	(hunting) search for game
drive	v	34:34	(hunting) chase from cover into more open ground
droll	s	1:1	comical in an odd or whimsical manner
drome	n	1:1	an airfield equipped with control tower and hangars as well as accommodations for passengers and cargo
drone	n	7:1	stingless male bee in a colony of social bees (especially honeybees) whose sole function is to mate with the queen
drone	n	7:2	an unchanging intonation
drone	n	7:3	someone who takes more time than necessary; someone who lags behind
drone	n	7:4	an aircraft without a pilot that is operated by remote control
drone	n	7:5	a pipe of the bagpipe that is tuned to produce a single continuous tone
drone	v	7:6	make a monotonous low dull sound
drone	v	7:7	talk in a monotonous voice
drool	n	4:1	pretentious or silly talk or writing
drool	n	4:2	saliva spilling from the mouth
drool	v	4:3	be envious, desirous, eager for, or extremely happy about something
drool	v	4:4	let saliva drivel from the mouth
droop	n	4:1	a shape that sags
droop	v	4:2	droop, sink, or settle from or as if from pressure or loss of tautness
droop	v	4:3	hang loosely or laxly
droop	v	4:4	become limp
dross	n	2:1	worthless or dangerous material that should be removed
dross	n	2:2	the scum formed by oxidation at the surface of molten metals
drove	v	25:1	operate or control a vehicle
drove	v	25:2	travel or be transported in a vehicle
drove	v	25:3	cause someone or something to move by driving
drove	v	25:4	force into or from an action or state, either physically or metaphorically
drove	v	25:5	to compel or force or urge relentlessly or exert coercive pressure on, or motivate strongly
drove	v	25:6	cause to move back by force or influence
drove	v	25:7	compel somebody to do something, often against their own will or judgment
drove	v	25:8	push, propel, or press with force
drove	v	25:9	cause to move rapidly by striking or throwing with force
drove	v	25:10	strive and make an effort to reach a goal
drove	v	25:11	move into a desired direction of discourse
drove	v	25:12	have certain properties when driven
drove	v	25:13	work as a driver
drove	v	25:14	move by being propelled by a force
drove	v	25:15	urge forward
drove	v	25:16	proceed along in a vehicle
drove	v	25:17	strike with a driver, as in teeing off
drove	v	25:18	hit very hard, as by swinging a bat horizontally
drove	v	25:19	excavate horizontally
drove	v	25:20	cause to function by supplying the force or power for or by controlling
drove	v	25:21	(hunting) search for game
drove	v	25:22	(hunting) chase from cover into more open ground
drove	n	25:23	a group of animals (a herd or flock) moving together
drove	n	25:24	a moving crowd
drove	n	25:25	a stonemason's chisel with a broad edge for dressing stone
drown	v	6:1	cover completely or make imperceptible
drown	v	6:2	get rid of as if by submerging
drown	v	6:3	die from being submerged in water, getting water into the lungs, and asphyxiating
drown	v	6:4	kill by submerging in water
drown	v	6:5	be covered with or submerged in a liquid
drown	v	6:6	be in danger of dying from submersion in a liquid and asphyxiation
drunk	v	9:1	take in liquids
drunk	v	9:2	consume alcohol
drunk	v	9:3	propose a toast to
drunk	v	9:4	be fascinated or spell-bound by; pay close attention to
drunk	v	9:5	drink excessive amounts of alcohol; be an alcoholic
drunk	a	9:6	stupefied or excited by a chemical substance (especially alcohol)
drunk	s	9:7	as if under the influence of alcohol
drunk	n	9:8	a chronic drinker
drunk	n	9:9	someone who is intoxicated
drupe	n	1:1	fleshy indehiscent fruit with a single seed: e.g. almond, peach, plum, cherry, elderberry, olive, jujube
dryad	n	1:1	a deity or nymph of the woods
dryer	a	17:1	free from liquid or moisture; lacking natural or normal moisture or depleted of water; or no longer wet
dryer	s	17:2	humorously sarcastic or mocking
dryer	a	17:3	lacking moisture or volatile components
dryer	a	17:4	opposed to or prohibiting the production and sale of alcoholic beverages
dryer	a	17:5	not producing milk
dryer	a	17:6	(of liquor) having a low residual sugar content because of decomposition of sugar during fermentation
dryer	a	17:7	without a mucous or watery discharge
dryer	s	17:8	not shedding tears
dryer	s	17:9	lacking interest or stimulation; dull and lifeless
dryer	s	17:10	used of solid substances in contrast with liquid ones
dryer	s	17:11	unproductive especially of the expected results
dryer	s	17:12	having no adornment or coloration
dryer	s	17:13	(of food) eaten without a spread or sauce or other garnish
dryer	s	17:14	having a large proportion of strong liquor
dryer	s	17:15	lacking warmth or emotional involvement
dryer	s	17:16	practicing complete abstinence from alcoholic beverages
dryer	n	17:17	an appliance that removes moisture
dryly	r	1:1	in a dry laconic manner
ducal	a	1:1	of or belonging to or suitable for a duke
ducat	n	1:1	formerly a gold coin of various European countries
